id,nom,sexe,date_naissance,specialite,email,cv,adresse,list_telephones,list_prenoms
79a7dc4c-d2d7-491c-81c9-7ea0347e6d3c,hovenqwx,Female,1995-10-06,Orthopedics,twlaz@domain.com,ybkmizdgupqcsjtlwfrv,numero: 73; street: mbfengqjtc; city: tniqgh; postal_code: 37690,+4025321520; +1063148061,fkisbr; qcnip
9d1c748f-93e4-404c-b200-2b029df60622,lempwvsx,Male,1984-08-09,Dermatology,mjzph@domain.com,crxidovwltagbkfephyu,numero: 32; street: knqcwpgldi; city: jbsrzg; postal_code: 20736,+2400318015; +3717700140,zikjly; ioylr
0d3fccc8-5718-4f30-8ed3-daee2a73e2f5,nyqhdxfa,Female,1983-08-08,Cardiology,vljzu@domain.com,sxiupdlhatjbekmgnfrw,numero: 31; street: cgbnoltfzx; city: etfhqb; postal_code: 94279,+5924559010; +4059892465,baxsyv; eaykv
ba07fc9a-1de0-4ee5-8a38-820ed7065fd9,ixqrgneh,Male,1977-03-26,Cardiology,iypnk@domain.com,msbaevcirnldjhtqwfpg,numero: 63; street: ejgwvfyspo; city: wujmph; postal_code: 73851,+6009067064; +6303089688,ndgpaf; lmtov
4625a909-e3d5-48b4-93bd-38ae3bd33ddf,uhaoedlr,Male,1967-01-03,Dermatology,zmbcf@domain.com,oczpmksjxtgyebrhwduf,numero: 71; street: zjetbkpuvi; city: zcqtoe; postal_code: 16617,+5368551082; +9762342236,hitvxa; yqdue
cd718287-1c4f-4bb3-8466-4f3cf406376c,nfksuelh,Male,1986-11-03,Cardiology,ojyip@domain.com,nmluotbdfsgwhxkarcqv,numero: 29; street: hxfkqdruao; city: kdvezf; postal_code: 70413,+2146456095; +1495798302,wkcdyh; izwef
41d0f1ad-6db6-442d-949f-4c9e19e08efe,sxzqgmvi,Male,1972-10-25,Dermatology,hmsuc@domain.com,izlnwrytpkegaovhqjbf,numero: 41; street: xkmspgnzae; city: ltfjpy; postal_code: 52730,+7172452911; +1242009328,zulcgm; nxufl
7249213e-897a-4cf6-9837-af8501faca1a,qaorseml,Female,1967-07-18,Neurology,kmcpn@domain.com,hwlgdumkcebpqvxszfno,numero: 90; street: mrsuopyezx; city: qbkeuc; postal_code: 14032,+2594474033; +7369204480,cdmpqk; odbui
a80fea42-4935-4a99-848d-6f5f5e41210d,cjsrumzh,Male,1970-01-03,Neurology,hwqfm@domain.com,drgfhensklpwjuyxzcqv,numero: 33; street: tubdneazrq; city: pisqta; postal_code: 13382,+5656634964; +9079851909,zyaltw; fawmj
1b85d358-14e1-4295-88d1-2b9212e49b90,sjfwqxgy,Male,1971-07-26,Neurology,pqgoc@domain.com,hcqkyfjuwdtgsinaxrov,numero: 58; street: pdokwmsyiz; city: rvdzua; postal_code: 11877,+4583928872; +3380246760,gvxoyd; tfzbn
1229ea52-ec26-4f76-8d93-63c3778c4007,uhnpdmvs,Male,1985-07-18,Cardiology,gzusi@domain.com,etpounjsvkahixbgywlc,numero: 55; street: jcvbkrtsmd; city: rsxqzi; postal_code: 74983,+8636014138; +2811733521,hndwck; jnemb
eb49fe3e-4134-4594-b328-c9e9b4a4ccd9,qimdkewr,Female,1960-10-24,Orthopedics,cikyv@domain.com,smblnkfvwtgeyrjuphqz,numero: 20; street: ydvahogmlw; city: fudmkp; postal_code: 65915,+6075160928; +1168415220,emyrab; hgtfr
15914513-bb9e-4d77-b877-c0b097f9085e,shepmkdg,Male,1988-09-19,Pediatrics,dtgbj@domain.com,grpljcwebufdvhomqaky,numero: 22; street: gwufxltezk; city: bvhcns; postal_code: 48288,+3150798603; +6214537105,yfpqtz; xhckf
fc914f52-9cb2-48aa-a5fe-8a52363a255a,cbtjnfwv,Male,1985-09-26,Pediatrics,ialby@domain.com,tgopfxaqbhlyivrwdkun,numero: 71; street: zapfknyvtx; city: fwxkvn; postal_code: 46359,+6010483067; +9281929144,jydqin; kwisr
452d7071-17a1-421b-90c8-992fa4369a1a,jqifzxkv,Female,1990-04-06,Pediatrics,aqizy@domain.com,avtsgzwclqrnkjxmyduh,numero: 54; street: jusvzowebf; city: zkupdw; postal_code: 64154,+7043050318; +9727720368,vafwsk; xovth
94721fe0-cbab-4a76-b94e-4b9f623b0958,qzdlpmxg,Male,1966-05-02,Orthopedics,qjluz@domain.com,nyeawfojixhdmtclkuvz,numero: 2; street: rgahuqpofj; city: fwyjcq; postal_code: 90460,+4973908281; +8962947205,wgpkcm; bwcyi
733a6f88-c204-44c7-abf1-a5c3d536685c,xrhnukqf,Female,1983-05-30,Orthopedics,holxa@domain.com,uqlfcewnmbdozshtaxgk,numero: 80; street: qkjegtaslm; city: adswjz; postal_code: 57923,+2948561316; +3680551307,kateqd; rjkvy
069135fd-7856-4f09-82fd-8dce1266c349,olgaxhnq,Male,1973-03-11,Pediatrics,skrfa@domain.com,ebinthqrumdsogwvyapc,numero: 75; street: nmxohivlwk; city: bskpqe; postal_code: 86526,+1621640461; +7142156804,crtmvi; brtyi
f5376516-8122-4550-a891-c92d85c6baaa,ueyockhl,Male,1972-02-03,Dermatology,dksxw@domain.com,wylszhkvaicjogfudebx,numero: 31; street: uxmptenvha; city: dwogpx; postal_code: 33675,+9867498347; +7222570863,pebguh; qezxl
54d53d27-41eb-4767-96a5-906a98301af6,hvkoifpa,Male,1987-10-20,Cardiology,nrszi@domain.com,xpozlarqkuhbcvwgifts,numero: 13; street: kiwxfnuovg; city: dasnqv; postal_code: 56134,+4791450370; +3382681213,ucrtdj; nljtp
9f442873-cec7-42bc-bd21-6ae4aa1e00ca,gpsztdlv,Female,1983-05-25,Dermatology,xifet@domain.com,dnimeyzgckfrlahjqvbx,numero: 14; street: qhsjiwfogu; city: jokazq; postal_code: 40216,+1599710486; +8265596122,hygbce; ehdxv
50a49259-81bc-4c73-9e35-c41d25a830eb,copaenqj,Female,1983-10-10,Pediatrics,bryfw@domain.com,fwiogtlazdnpxvqbruce,numero: 20; street: qwvsmokdub; city: ctyijs; postal_code: 72311,+8340434712; +3435364563,apvcxr; pkcvg
6ee3d08f-5830-4fd8-a1a2-30d3eb34cc01,qxljrbzw,Female,1966-06-14,Dermatology,txfvu@domain.com,euqzivjbcsdlxtyfpnhg,numero: 32; street: obmdqsznug; city: nywoet; postal_code: 86208,+1943218688; +8711745009,pdjsbt; xpjft
cc35c15c-88ec-47bc-a737-c4420c403797,qchirewy,Male,1988-08-15,Neurology,gfckt@domain.com,ityagohxeqrcfkzlsvpj,numero: 29; street: ytvwzhbsmd; city: rqkbuh; postal_code: 85847,+2795313092; +5809275971,yhobie; scltm
bd786229-1853-4025-baa8-7e82f4678539,lgmbfnrh,Female,1975-11-09,Cardiology,yibmg@domain.com,szrlebmcwnxtgaoupdqv,numero: 23; street: fcuotbrdpa; city: zubots; postal_code: 80006,+8010263983; +3605236598,ftzdbn; obsmk
cc7820e1-0534-436c-835e-c9ddc3eed54a,gbfkmesu,Female,1988-07-29,Orthopedics,aejup@domain.com,ostuzxrjpvmbiydlhawq,numero: 76; street: qnyxwsapgl; city: exrkif; postal_code: 68673,+6358892586; +9158201544,irozev; vdpzo
ac14e444-10d3-49f4-b588-22ecae8841f8,bdxqgyht,Male,1964-05-20,Neurology,rejak@domain.com,xojpaeqsnkmdfytuhwzc,numero: 78; street: euqcdgwljf; city: zsigmf; postal_code: 29714,+4577914829; +3379271549,hczira; amxdz
59282d8e-60c6-42a0-9e42-7bb70ef13037,hqspvigl,Female,1982-10-26,Cardiology,fjhac@domain.com,gpehzwrlnqjcustkbmyd,numero: 70; street: wrctajfehp; city: bszwki; postal_code: 45856,+2342901767; +2684262051,beqngt; kscyg
fd06de1c-332a-4017-bbe6-6d66e54bd9b5,xtcyufap,Male,1992-03-14,Neurology,hemtw@domain.com,carybwhipqvkzjxdnmsf,numero: 23; street: pgrakzdoms; city: dourkh; postal_code: 81572,+5403144072; +1162746819,tqvwub; asubw
d6dbb3d4-416e-4b46-989a-a15397f1ffae,zjqdpbna,Male,1987-06-20,Orthopedics,zuyht@domain.com,ztpjsagxnyclhmkibufq,numero: 51; street: icskpzwulg; city: jnkbts; postal_code: 72674,+8243825120; +6443135690,fylgso; cojzi
a81b6d6d-ab8e-4d11-8348-c489ce5c82b7,rydfiobw,Male,1986-09-13,Orthopedics,octng@domain.com,ivsunkgdmyeljqahfowz,numero: 61; street: wytpbgfhrn; city: etuvco; postal_code: 48089,+1836722508; +8491448946,qvwilc; xsuyp
318003ea-98ad-48ab-9de1-5e90cbaeae3c,cydtmwqf,Female,1972-09-28,Pediatrics,duobs@domain.com,tlrsgjifanmwxekqopcz,numero: 48; street: fgyzbwekvt; city: vluzak; postal_code: 78893,+7834353480; +7680725664,pkxfbe; jtgcr
1df2b2b6-885b-4c1c-b727-694b8a524c1f,tudzpjcm,Female,1980-04-12,Neurology,ntzmo@domain.com,lqzdogwemsaupvbnxhic,numero: 66; street: jamxqfkiug; city: xutrwy; postal_code: 52088,+9741426215; +5027971248,yiznrx; wmuda
34854d88-5296-445a-92fd-2296d62aebdf,gsilxobv,Male,1987-10-12,Cardiology,qgyjv@domain.com,bfjtepduwzvykqnrxolm,numero: 52; street: ltdxncvibw; city: iczubw; postal_code: 57194,+6906089820; +5061286959,ikgwuz; vxoig
5438f789-61e8-44ee-8e48-a39c8116654a,axytqwjn,Male,1967-02-20,Dermatology,dnqfm@domain.com,vmbkfawdoieyplhuzjcs,numero: 90; street: vgycnueowa; city: lmvqsd; postal_code: 14771,+6200833465; +7761979136,uhvwjb; nsadh
3e29d9df-ee31-4a41-a077-a521e29f7959,frhyqkci,Male,1990-07-03,Pediatrics,xtdpo@domain.com,yospamjziglqvwcdxbhf,numero: 31; street: lstgmnwuyk; city: ytwkgb; postal_code: 62737,+9331935186; +7168815257,wxfbyn; wodye
9a73495f-72cf-46a7-8726-5c9bca8f2511,jqglfxpd,Male,1978-02-07,Pediatrics,zqchw@domain.com,xgwphoktbmcqydzfljne,numero: 15; street: oqljpvxkna; city: uitlgv; postal_code: 86163,+2340008336; +9757611294,zrslmh; zasey
e9991cab-f905-4de5-b810-2861a8224ae0,nrwysqbj,Male,1974-03-05,Pediatrics,rqpfy@domain.com,mcyjprozwaldqbfegvku,numero: 4; street: pmoebvqniu; city: xeygbo; postal_code: 25186,+3003071293; +9333312258,rinbje; hfmtu
52305435-afef-4e46-8292-02789f4b6bb6,qevixwmp,Male,1969-06-29,Pediatrics,esbvt@domain.com,bzhcvwjykdmgaluxosir,numero: 14; street: xbvnsymitw; city: azqwve; postal_code: 91452,+3560306641; +2806499704,mqxoph; gisea
8d2d576f-a0e1-478c-aaf3-5978bba7b280,gpizdhqa,Female,1960-10-29,Orthopedics,wsadv@domain.com,yvajdoskfxmgwpzbctrl,numero: 10; street: zrbugsvwhp; city: ciebyd; postal_code: 94030,+9251957333; +4431303430,lwbpnd; qmieh
ae228a94-d915-45e4-a2f4-ad13dc60087a,lpvywbha,Female,1961-10-29,Pediatrics,faixz@domain.com,wetrpnidfjkxmacluqby,numero: 73; street: enwmfhpgqa; city: jvzucf; postal_code: 21111,+7112588173; +1781385417,zsvumj; ymbcp
87f11d70-61f8-4872-91a2-3e8b5e280843,mpgnuxir,Female,1990-05-16,Pediatrics,hymkb@domain.com,exmhpunyiajvtgswzlod,numero: 54; street: bsupqeznlv; city: cbyeiu; postal_code: 12639,+4166187607; +5632502030,iaqpmv; owaly
570f0d82-4571-4ee3-8a94-a83276cdeb39,jawucyxe,Female,1980-06-19,Cardiology,shcyz@domain.com,dcjnbsouvafgxezhympr,numero: 55; street: kxyqelcatb; city: qfohez; postal_code: 19261,+2023409034; +9461023174,csjuvh; zvikl
84057d0b-bdf0-4615-8dfc-b9480ef95ec1,oghxctyr,Male,1961-05-17,Neurology,pucid@domain.com,evgjtskxpaolfbyqmznr,numero: 100; street: vromfajzsc; city: xiluhv; postal_code: 22603,+7580510671; +3347441528,ilpxue; wbosa
46164dfd-ecca-499f-a149-6721becafc5e,mgptnrev,Female,1971-11-14,Pediatrics,vmdak@domain.com,tcxserzqgyvwhnopkjdi,numero: 64; street: hritpylnmd; city: dqurjs; postal_code: 94907,+4006205399; +1542307001,hpfvdj; zvunq
43a1b562-54c7-436d-81f7-ff444d136a4c,hdaentum,Female,1961-01-19,Neurology,xymcu@domain.com,nsagdcibujqokvtrlhwp,numero: 93; street: biudxmkhzs; city: cjobkz; postal_code: 47562,+2923609504; +1599154071,lvefxc; racmn
451c68a5-4610-491e-a269-23328042d1bf,bpnohvlf,Male,1970-05-14,Orthopedics,blmcj@domain.com,tqbajnrgzsvfpcldxkwe,numero: 66; street: kmerjhyxon; city: qljidf; postal_code: 72318,+3633833389; +8578969580,mtrclx; tqpku
62aa103a-5e61-419d-87ba-9220e6030b6d,nulkhpbw,Male,1976-05-22,Orthopedics,vlhwj@domain.com,eqyprofwtsnimglhuabc,numero: 92; street: qkgphymbxl; city: glirzs; postal_code: 99725,+3836810494; +4522278111,lpsvkn; vmgbc
3408b267-9cd2-4c82-80b1-996dc91703f2,okgvfnys,Female,1985-10-13,Neurology,qurow@domain.com,uagzxeytmodwcqvrikjp,numero: 86; street: qgfiohbmvt; city: bukvfw; postal_code: 60844,+4960634791; +6126735075,fmaodr; ywfxi
61446bbc-ba48-473b-9936-e414f48a5975,mtjihksg,Female,1967-01-25,Orthopedics,flncv@domain.com,ouchbzyiqwnfxvljdrsk,numero: 87; street: tfxpneawbv; city: pnkhea; postal_code: 91008,+1367300752; +8590597161,lhbnxj; rvuis
ae490bb3-273e-4436-a1db-bc878e770252,cndxqkew,Male,1991-06-05,Dermatology,abihq@domain.com,helutmcnfyxorwvsigpd,numero: 66; street: bzlhtsndxa; city: jglfym; postal_code: 51154,+9389593908; +2956786925,webhia; bnjgh
59dcabe2-60d0-4cbb-9bca-f4a273ba82f2,uzdpxyav,Female,1994-09-24,Neurology,rycoe@domain.com,vwnpqefgtzscaihmdrjb,numero: 88; street: wnjkgvfysu; city: hotvrc; postal_code: 32669,+2872052613; +4516372956,igqnks; epclq
d7bbff67-5fc4-47a9-95a3-697aefe08f3f,pyamtskb,Male,1971-05-22,Dermatology,kugqt@domain.com,bohevzkcidrlqmufywxj,numero: 73; street: vofpwzcmqu; city: sgvntp; postal_code: 84055,+4628823038; +7565651808,qrjsdk; ethbu
92fbe6d0-a49f-4adb-9b1c-80b3915c8a69,ivojmdal,Male,1977-10-14,Dermatology,xajkh@domain.com,ctxvsmhydgziqlnupafj,numero: 38; street: bxplukrsqi; city: nysfue; postal_code: 25080,+4000716923; +7144675948,wubfcs; xwydg
f92759f8-c12c-4fa6-8aab-a2ef64ed6c6e,ecsjbdfl,Female,1975-11-23,Orthopedics,jscli@domain.com,unwvyjgimzredoftxpas,numero: 20; street: maknfltcye; city: dxjkhu; postal_code: 43692,+1056643177; +3554516355,bncfpi; tzkpy
7c85b416-6066-48f9-b5c1-ba5af8d6e05b,qhdxzrmu,Female,1977-12-23,Neurology,rpzby@domain.com,vjolbsghyxmwaqincezt,numero: 81; street: ofumdianjc; city: xjhpal; postal_code: 10385,+8083561873; +2578815194,tilawb; chbfr
b0aa3e68-d443-497f-a04f-7f376eaf36c5,torknbuj,Male,1960-12-24,Neurology,pcrot@domain.com,jbayqzmevgsuxtcdrhpl,numero: 58; street: ahfpgzxnuq; city: zgeica; postal_code: 62058,+9470077169; +8231189204,newkxr; aygtb
09e7f91d-b968-4d4f-96d1-87ebfb47abab,syijzcnl,Female,1967-03-12,Dermatology,mstqf@domain.com,kslpdrbjagntuyceqfoi,numero: 60; street: bfwsrgakme; city: chvdau; postal_code: 18254,+8161945708; +8664316317,uiqnso; tneby
642d5cdb-10b2-46fb-ab3d-15fa426ba69e,qahpjdlu,Male,1985-06-02,Neurology,yiaqj@domain.com,ftpsdzbwnhuylicvgxro,numero: 26; street: zahfkwgyus; city: mbkenq; postal_code: 52756,+1101225494; +4784394767,oenwhu; bqxog
add0d791-ad4e-4887-ae09-76c2a2123e6e,shtaugvd,Male,1974-06-24,Cardiology,dxfsa@domain.com,lfjqbcikazouhxsmydev,numero: 47; street: rgcwvimqbf; city: xaqind; postal_code: 72659,+2378949863; +1883023504,gnpqbr; tuydz
5b090605-acd3-4e94-8427-144dd45bea53,wgtsleua,Male,1979-04-03,Orthopedics,oignj@domain.com,hyfcnjtmxkalworpubgq,numero: 81; street: wogqptdhai; city: qmpevt; postal_code: 17975,+1262366874; +7607362622,xrqcou; gmech
5f2fbdae-fdd5-453e-b2c6-c521bd4c8f0a,bytexvmk,Male,1988-06-20,Dermatology,okrgf@domain.com,zlfospqbexdmycvwrkga,numero: 59; street: sctpwulhab; city: kfeorm; postal_code: 93379,+8880067911; +9583613006,ltzjnk; pwbia
9412af7b-04b7-4701-954c-0db2b0015e12,sbvqxwjf,Male,1978-03-06,Dermatology,solcu@domain.com,rqczhvgoduimxfyejawl,numero: 78; street: fkdhncmwae; city: jwxbhd; postal_code: 12239,+8016230613; +9017307410,utysbw; kdbwo
4b5dec2c-2ca0-413b-906d-19f8982b1f41,ycmpidvu,Male,1973-07-19,Orthopedics,zmink@domain.com,olwdqerthmivxscgbjkn,numero: 2; street: cvuyijdrms; city: obsmaj; postal_code: 13167,+4093781978; +4762919784,sdujkv; rzdtv
f5a86637-c759-45e4-a3ca-f3a591aab284,sedvzugw,Male,1991-04-28,Cardiology,gjdsa@domain.com,ipayqukfowzcnlxemtdg,numero: 89; street: femkghcndj; city: thalue; postal_code: 22277,+6290846344; +5579465988,snpbxu; vmjbn
2f08db62-e98d-4124-bfdf-c44de2f21e4d,fcpodkzn,Female,1992-01-13,Pediatrics,cqhlw@domain.com,cbxzewosdfmlrjquyivk,numero: 87; street: epntxlkaor; city: otnglq; postal_code: 66791,+8774850527; +5278469474,rcwsgu; zxqdu
1b603842-f04e-46c4-ba62-87a888647139,kupwmhzv,Female,1971-05-03,Cardiology,tmyzv@domain.com,zjiqntsuofrcebalydwm,numero: 83; street: lkgcxdstbf; city: evpskl; postal_code: 59653,+2046836965; +2463129582,tobkqm; keirg
126b9a52-f0bf-476e-baa6-241d2249f75a,emskvtyj,Male,1962-02-20,Dermatology,miobu@domain.com,oirygnsftpcaljveukwb,numero: 33; street: zhyawcefdg; city: cvnxhj; postal_code: 96478,+8747329554; +8387215633,pactje; uneiw
07b5d5fd-862c-4c9d-bc90-1ce8ac996670,vxjsfimu,Female,1970-03-03,Pediatrics,endgr@domain.com,blzmoevgrnatqiksphxy,numero: 13; street: jsiktfebol; city: usdpwj; postal_code: 26714,+4388518484; +4487570278,zhqaew; bvqgy
04ec2e48-f307-466b-b3cb-9e71fe7d73a8,qwefidyg,Female,1967-10-27,Pediatrics,wcoyd@domain.com,loawhrqjstubcxkvfngy,numero: 33; street: octdxufsqy; city: mxblah; postal_code: 65460,+5742278671; +9331122164,mwoxua; nsbvy
a22e0fb1-af33-4510-a201-c00f97ed4d1d,bytpimjg,Male,1981-01-21,Orthopedics,jnuzl@domain.com,vxfhyiwsjozqerpdmnac,numero: 99; street: ouxlrbygdm; city: vapmhc; postal_code: 70302,+9875876501; +8655811559,kbswxd; vamhu
a5499aaa-6e98-421d-92a1-d17a0e4b5c09,irtpdqul,Female,1984-08-11,Dermatology,byuap@domain.com,maxlidwgbqksjuncthzo,numero: 23; street: piqcoglhws; city: adutim; postal_code: 51466,+6110370096; +1872641410,btpuiy; wrtjg
b6289ba0-c33b-445d-8541-f129d29e45fd,dmezfogn,Male,1989-10-03,Neurology,rvmok@domain.com,abrdsyncztqgkphexfmi,numero: 8; street: kqczfmwidn; city: xfsnqu; postal_code: 81672,+3081187013; +6808716470,qwecbk; xozkp
3ffbdf92-ff77-4a8b-afeb-c77e2ec9462c,lugxyksj,Female,1983-07-31,Cardiology,gftoz@domain.com,glvjnfqcxawpkeosuhdz,numero: 18; street: sthzplqrcm; city: oaxylw; postal_code: 53666,+2966637846; +2947666119,vxmkjt; jaoql
d4bae58c-713d-4afa-abf6-f47aa566ee69,adkphlvq,Female,1994-02-10,Neurology,lxqpi@domain.com,sihrtqfyacvjdnglupmx,numero: 81; street: prfweskjyo; city: naumqy; postal_code: 75583,+6236345112; +1771191006,saplmq; puolm
07d904bb-4292-43a6-aef4-c34d8dad49c7,jrxwelgu,Male,1962-12-09,Pediatrics,ctzko@domain.com,kxhtecuriywgovzbqjan,numero: 44; street: yroqvjtfxs; city: jhluzw; postal_code: 86185,+5097697591; +5427464918,xkiulq; xhtml
d83b05b3-68b7-40ca-9095-cd221f05374d,osynpmxc,Male,1971-01-02,Neurology,axust@domain.com,ktifuymwnzglhqrxdsej,numero: 47; street: shvkqrugfo; city: iazuvd; postal_code: 19096,+4277301986; +1082968769,andrcz; bjthi
4e5476f9-db87-4849-9900-595da0fe17d4,syegbtzp,Female,1977-09-01,Cardiology,wbscu@domain.com,ptdejlmibnsrhoczagkv,numero: 24; street: qvlesmhjki; city: hgtrzq; postal_code: 96187,+9497241002; +6182127311,wlnxpv; gxkhd
2c6bfc31-364d-4c03-b675-85930fae6efa,ksibxeot,Male,1982-11-12,Dermatology,ahrtd@domain.com,dsroyfumngeqwajihtbl,numero: 84; street: nohwpizsem; city: exdfzm; postal_code: 91745,+1511807015; +5730393856,nkjwby; jpaqw
ffd041ab-5c80-41ab-a08d-67ad64cac3c6,sjykilrh,Male,1989-09-26,Orthopedics,ytvcn@domain.com,snuapkqejfdtobzxcymi,numero: 63; street: gxhjyctfbs; city: verzqa; postal_code: 89531,+6527786070; +5252834102,jsedto; dsvai
4e5ec4b2-d387-43a2-b9d2-4963b0997b02,stdjxvqz,Female,1987-03-20,Pediatrics,yepjf@domain.com,fkesvbhcywtnxjrlgmop,numero: 25; street: fqzigmrcnj; city: kxbdny; postal_code: 88528,+8044118322; +2164679078,duozcm; pwnvb
eb7ee897-8cd1-4364-887f-ad38e611aafa,mjlucpnh,Female,1963-08-21,Dermatology,akdhv@domain.com,rfhjqydmzcliasbgtnvk,numero: 88; street: izyxbntmvc; city: woadce; postal_code: 56411,+9519498470; +5281629002,aktugx; thogk
96301ad6-6dcf-4adb-9d65-782d502e0602,ilrspdnf,Female,1994-07-09,Pediatrics,idutp@domain.com,dyuarcmnvxgtzwolsfeh,numero: 54; street: zboaqgkvfy; city: olqeih; postal_code: 34265,+6424931646; +5858365935,dxoewn; whgjr
07bc21cd-7a02-413b-980e-4488e0ece4b0,iyvqzkab,Female,1978-03-26,Pediatrics,wqslm@domain.com,cibyngfqjtpakevxwhlu,numero: 20; street: wlchqxbves; city: flhoyz; postal_code: 78743,+3731068061; +9611840972,rkduot; dlpmg
f213aa3e-1021-4a8b-b1f5-934a76a98f1b,suyclhtn,Male,1970-12-29,Orthopedics,rgjce@domain.com,juqznckfhldoitvarmgp,numero: 3; street: qmkndyctjv; city: ptosci; postal_code: 82085,+2298414940; +5139747012,uoqxif; prnqe
28a8a5e4-5f85-4c53-a503-3ec0a51cc5df,lubvwnog,Male,1963-08-19,Dermatology,pfzgq@domain.com,etogfzqdkjscamvbriwy,numero: 87; street: gusjkarhdt; city: rzitmy; postal_code: 96887,+6885968421; +2111539127,snvahl; kabli
cdfc6c93-015c-4744-b5ba-6c196e38e903,lbgzkuif,Female,1962-09-17,Orthopedics,jvpwi@domain.com,htjgkovqeflcizpamrxs,numero: 61; street: vedwyftizh; city: sxwebf; postal_code: 40558,+8559462707; +6833288301,klimsz; nkpqz
e45bfbd2-42f7-42cf-8f1c-5513f8483324,xyoengjs,Female,1979-12-04,Dermatology,qgiws@domain.com,pkueatmiohwjdybqsnrl,numero: 100; street: gefvsylctu; city: mrdhye; postal_code: 17314,+2466344394; +1387045002,uclbtr; outip
cfd289bf-b072-4f46-b0b9-93cd9d10a452,ygazbvxc,Female,1987-09-30,Pediatrics,jdmuq@domain.com,cuqyvabdgkfwnjtihosx,numero: 46; street: ljtrqubpch; city: bigkoc; postal_code: 89732,+1030434617; +9639680804,bynfcd; pmrok
88d370c1-ddae-4dd6-a055-27187579b472,hiprujma,Male,1963-02-20,Dermatology,bmuxk@domain.com,zlskhrjauqwtxybidegm,numero: 64; street: hmprsebqfn; city: lsyqag; postal_code: 23665,+9764253822; +9310037826,pyhitk; oxhws
9dacb9f4-8b26-4d63-b4e7-812fa89904ef,ayicfoek,Male,1985-01-29,Dermatology,ietqp@domain.com,slhxzugqjfmibovtnpyd,numero: 45; street: qaghunwdso; city: wazexi; postal_code: 96702,+8891554267; +4881303056,vnwyqb; apiho
c68e3a99-14d7-425d-b2de-8834b9ba38c9,fklogwsn,Male,1992-06-20,Dermatology,zagrs@domain.com,hktyjgqbmpcvxfidlron,numero: 84; street: rwhtomqyec; city: tsgljb; postal_code: 58892,+1288288346; +6979790478,uvgsfc; xkzhj
c419f2c0-1f04-4314-868f-2cbe04e67acf,avgliotc,Male,1965-05-20,Dermatology,lswfi@domain.com,wrsuzdpixnyavmqtcolb,numero: 22; street: ltisojxrwy; city: xselid; postal_code: 23124,+4698707063; +5847386961,pfrlnv; gnuyd
f4475d68-a7f2-41b5-b2e8-089183445f58,fzukhrvp,Male,1978-01-05,Dermatology,odlev@domain.com,zmhguqpicotjkxwbdfrl,numero: 35; street: ohrxgmeazq; city: fdgsbc; postal_code: 60397,+3274563355; +3733237395,zuwbnm; ewvxt
bff9b2a6-a21f-4027-ab94-44a1d2d72066,akocpwzx,Female,1989-09-17,Pediatrics,xgzkr@domain.com,nvsoxkwguypctrlebjdh,numero: 49; street: yofwejprbk; city: kxcuwr; postal_code: 53442,+6730572267; +2178787365,ohpxby; xcdul
9a532ad9-026f-455f-9982-592f59415a19,xbsgfely,Male,1989-02-15,Orthopedics,smwrl@domain.com,atcgwbislhkmnzdoexpj,numero: 21; street: gkuhmesjyd; city: uxvfrb; postal_code: 40747,+7247165455; +9942628263,dctojy; joxvg
219a2c58-9236-47a0-a6dd-6f84e369a47e,wnfqjcih,Male,1964-09-02,Cardiology,urlxy@domain.com,symjizvgndoqtlhauxpr,numero: 20; street: uxhrqfadsi; city: rhboec; postal_code: 93287,+4927657277; +1806563154,xfgbaq; ktnji
c1226448-4402-43a0-a377-c4ec625a2355,sbwhkdgp,Female,1969-10-27,Cardiology,ecidw@domain.com,nyxlhizprswjfgetdabu,numero: 72; street: trqjbzviad; city: kpuwvj; postal_code: 44878,+8976695372; +8617005866,ubzjsd; pifon
c7636394-9b43-4a43-97e9-ff5ed9dd5bc2,dtaxfbeq,Female,1966-11-05,Pediatrics,pdemw@domain.com,xyluwkhcdafotjgienvm,numero: 89; street: uikbfydjgs; city: ztaesd; postal_code: 41714,+3664995624; +5029890264,yjocwr; rdcaj
3f727492-8d72-45ae-9391-fe04fbcfe425,yskgiwjm,Female,1967-03-25,Dermatology,cdmse@domain.com,zmnoxdilupkragyqbvef,numero: 48; street: ihxfvnpbak; city: qtxgrd; postal_code: 97416,+5363760162; +1126676841,lucash; pcuzw
0b92f655-c35d-4b81-8c54-a222c09126fb,avhfsmil,Female,1966-01-10,Cardiology,cpqfg@domain.com,zlrmodajixcvwqepbkhf,numero: 10; street: fjvqmswety; city: buyrqw; postal_code: 16333,+5095212024; +4822685314,gxmthp; ydcxm
198595a4-8f22-40f4-82a9-4dfadc853411,hfnvmgeo,Female,1989-12-02,Cardiology,yktji@domain.com,gbjvklemhotqdfcaruwn,numero: 32; street: ceatgzurwj; city: zakbvg; postal_code: 53457,+1851878941; +2489410769,szayer; xgsoj
3a504527-9d9d-4faf-bfea-5cd4cbf0c560,mhqwjsiu,Female,1976-04-29,Dermatology,ucovn@domain.com,ktadvlypqiefznrsbchm,numero: 99; street: fapdbqwngt; city: mdauej; postal_code: 88096,+1473518489; +9359678409,cjuifo; tucsg
8d387e94-a35a-4dc9-be3b-0acdcd8a09d6,lvztqyex,Female,1976-11-16,Neurology,fwtez@domain.com,qhbuifkovmnsdclpwjga,numero: 24; street: ndyiaxlbsc; city: oecfqs; postal_code: 82544,+7442339060; +3182512522,kalucd; bhxoj
10dcaa29-2e27-4ae7-984a-12050f4c1993,cbnayzvu,Female,1965-04-29,Pediatrics,lfmzy@domain.com,svaxkoipretfdjcuylnw,numero: 12; street: jonyahwvez; city: xjmzvg; postal_code: 14872,+6168024807; +9691386163,etcbol; qldeo
5be8d29e-202f-4956-98e2-99a370aa41ec,fvmpqlsc,Male,1976-09-25,Cardiology,uxabn@domain.com,khjcqxmpugoadtbylzsi,numero: 95; street: brdwmcozkp; city: yomziw; postal_code: 73652,+2455751286; +8640171016,uqjiwy; qmulo
43f69a17-682b-4f1c-9eaa-911769d97315,mwnfehik,Female,1961-09-01,Pediatrics,jnmdt@domain.com,kzuoaeqnjfylrdpbtsxh,numero: 20; street: shcnfyiwuz; city: jndwha; postal_code: 88502,+4075872102; +1079334207,sivgwt; kwugp
de4b8153-de18-4d31-8a08-471c1e38f7b5,mewrvjnx,Female,1975-10-16,Neurology,qighp@domain.com,osngfjyidbmqpwultavh,numero: 72; street: hetorscqxy; city: nzvlxy; postal_code: 30954,+9444063201; +1728948139,zjusgw; lwhtz
735aa8cc-c5cb-41be-b8c2-973859723b0c,phfgztxy,Male,1960-08-04,Orthopedics,cuhwg@domain.com,xwakpogrsjbvmecyizqf,numero: 77; street: fdyevjlqnp; city: jhidrm; postal_code: 73967,+6376151176; +1389788961,jabozx; icmyf
26c50f81-b8a7-4180-8a7d-dc39234e662b,ztapqfwj,Female,1994-06-26,Dermatology,bydks@domain.com,epxrzlnydcakwqtushgo,numero: 92; street: yeouhsazjp; city: gzukfe; postal_code: 13494,+9112271004; +8785118993,vwbjuk; etdmx
637ef66e-168b-4979-aa66-c6ef53318be2,dlxbewhc,Male,1986-04-29,Dermatology,vyfcw@domain.com,bkzgqydwevjuonhfimla,numero: 11; street: vqbsfcjlpt; city: wxdvak; postal_code: 38721,+4488734689; +2019372810,dlwjmg; scfny
ad859d7b-3d5d-4319-a183-1a0667f403c3,krchstju,Male,1986-05-03,Dermatology,pnehs@domain.com,axehruzyoqfkvmtsbglj,numero: 50; street: iunlmqyszg; city: lfgzkt; postal_code: 14273,+1766831644; +2617473200,rqjgfw; jyapg
66df28f6-f7cf-4e80-b3b8-cfd0f47489fd,hnesatvz,Male,1995-05-22,Dermatology,khcsn@domain.com,xwyjrbpfuetqvakhiozm,numero: 10; street: stpnuogywc; city: oxiynf; postal_code: 79528,+5248310484; +6527342851,atvoqw; angid
dfbeea8e-c08e-4b2a-ac72-e5d10a6002ab,umaiptyo,Female,1961-06-27,Cardiology,fhclg@domain.com,tvajlsqcpizgnodkurhm,numero: 16; street: wubrmvloqy; city: pkzvhq; postal_code: 74078,+3987992933; +2912028895,ajnkqb; cgyqs
324e9391-49e2-4ccf-a4b4-8827f3830486,xvwhmcri,Female,1985-09-21,Cardiology,zmwxa@domain.com,iszklhnefgxwjvqtdroy,numero: 86; street: geanvqsxlp; city: drbten; postal_code: 66525,+8115189727; +2194584545,anfqol; ygcjk
aebf9cca-6ebb-4277-ab8d-3f7f02bd7d01,bgmslojy,Female,1965-08-17,Dermatology,chbkp@domain.com,vxfbuejzkalnhydpoigm,numero: 42; street: gszhatumoq; city: wylqjx; postal_code: 47031,+6240321759; +2985003689,zcofrh; iownu
29174f1e-2c88-4d40-b4f4-f0c6d8033de9,wrikmysh,Female,1988-09-21,Cardiology,flwkr@domain.com,gakpnyebtufmjizcvqro,numero: 68; street: qizmsfebop; city: rijzsw; postal_code: 57449,+7695673853; +5599676105,qxgwki; fvlsd
a411937e-4623-48e4-83db-e084902fa2e1,eyrszoib,Male,1994-11-10,Cardiology,leoaf@domain.com,iytfpwmvarehqdljckou,numero: 41; street: btonrgyzfk; city: budcxq; postal_code: 24708,+1425213633; +4359246348,irbnfv; yjvho
df6aa771-95ba-48b1-b7cb-256b85b3308d,hoatzreb,Male,1976-09-20,Cardiology,bxdyw@domain.com,inhlrxkzgmcdoypqvjua,numero: 71; street: abyofwgztu; city: ugprny; postal_code: 51977,+5366275471; +9511872444,kvuaxl; oiwyh
