id,nom,sexe,date_naissance,specialite,email,cv,adresse,list_telephones,list_prenoms
2028a5bc-f8e6-4ac9-a95e-02306ce2b390,jnfhdlvq,Male,1981-01-26,Pediatrics,iunhr@domain.com,ziqgmpbxdkfcslnrwetj,numero: 28; street: idatkrfvcb; city: hnmlxg; postal_code: 96923,+8566543780; +7430880980,qndzft; hbioq
4eb84e36-eca5-43ab-92ec-032bad3e4122,zdjhgnsr,Female,1985-08-20,Cardiology,qwnel@domain.com,tgzmhpoiqfjcsbdvueak,numero: 58; street: aqjbumlsfi; city: zntqja; postal_code: 61277,+5928005693; +4366343109,lsnfrz; eqfrz
5b0ed8bb-b609-4779-a052-1ad41df38dba,dbryvima,Male,1980-04-20,Orthopedics,lwbhn@domain.com,kcvlmniyxobfzdwuegqh,numero: 19; street: mvnaqpkjzl; city: ebnxkz; postal_code: 41547,+6758261265; +7694871314,apexkm; apcew
f045fddf-3a95-4043-b0ac-0e32e6c31905,wuhknqoj,Female,1976-08-22,Pediatrics,iqvoz@domain.com,anzskjtxgouqiblyrmdh,numero: 51; street: iatlpyxedq; city: plghaz; postal_code: 22260,+7708199533; +8990847988,qzkych; iefzh
56503134-cf5e-41d6-8992-962fa1f30dcd,dcjzoyht,Female,1965-01-09,Orthopedics,yviow@domain.com,cawzpinvhqgluexorjks,numero: 79; street: elygunsvxo; city: tyoxqv; postal_code: 72327,+1106273820; +3749798485,vrkqce; vhxlf
ec4f0b60-867a-4eb4-9c1d-1d63c0d4c6c6,nqixartl,Male,1995-05-25,Cardiology,cdgju@domain.com,rbvxfqkyiuwdepjcsgnz,numero: 45; street: sxvypkbewz; city: btyqnu; postal_code: 92971,+6073751212; +9392914599,ugarkd; mcnxt
780d4c13-16be-4c97-8fcb-078dea7e8102,ajofbizv,Male,1963-12-01,Cardiology,xnqlu@domain.com,uokamlrydvsehnzxtfgc,numero: 17; street: ymisatfwun; city: lcrgnt; postal_code: 41653,+6102625110; +1874151856,dakgre; kuvtc
49791232-55c3-4ec0-bd9d-f430584b2cdd,qhpjgnwa,Female,1992-02-15,Pediatrics,btxep@domain.com,gadmuyercksjowvpilhz,numero: 20; street: oqlavhtnik; city: evphmo; postal_code: 41345,+9111069439; +1902994032,xifzra; jrwyn
7f49a8dc-c980-4b82-99dd-a50f06be3025,halukqop,Female,1961-08-23,Dermatology,lepyt@domain.com,yhlkwizbaudopnmgxcjr,numero: 71; street: zxyncjpedf; city: srvjho; postal_code: 55681,+6301289474; +9969864616,ghsjxl; codme
8a36d3fb-0bf0-475b-b962-fbe4d393ea95,mapthuvc,Female,1995-06-22,Neurology,welaj@domain.com,zsvkxuglaripcynqotew,numero: 29; street: bguinzdvat; city: saledi; postal_code: 64411,+8526719259; +1734117098,nlumfq; xunmw
cd22ea06-f97d-489f-b2ee-d434bc5b2d1f,ilbfdywj,Male,1978-08-29,Cardiology,svhjn@domain.com,agqnltrjwbocxehpdmvk,numero: 56; street: mszibfhedw; city: mwbtez; postal_code: 56939,+4176382436; +9657176784,lnvzrh; xzcsw
5555dcb1-ad3d-4237-b406-ca4de6e61549,kcmbhinq,Male,1982-10-28,Neurology,jovsi@domain.com,gqcsewyhuvazribkdplm,numero: 10; street: nwmpsyfbgc; city: lkgfim; postal_code: 12280,+7825105200; +9112305244,vnblay; bgqfj
84b0d64e-a94f-4abe-a95e-c520cba25602,toeugqjf,Male,1985-10-11,Cardiology,kxhyv@domain.com,taujnoyewxsfpvzlrdqc,numero: 5; street: dzjombslvt; city: tmsfjb; postal_code: 29546,+2097411126; +4652789095,ixjhcd; cphmi
9a81b7e6-2dfb-4ef4-bf35-5e619d940cc2,mwbjiyrs,Male,1964-03-31,Neurology,otmcb@domain.com,jouhmterykwzflibdnap,numero: 22; street: cmklazhrfo; city: uxktob; postal_code: 67229,+2842598109; +3446678017,mqtcws; zimvb
99239c32-33c2-4ce7-9066-34dc15105248,nylbcfkm,Male,1979-10-24,Dermatology,imznb@domain.com,ucdfvxypbrmiatqgojeh,numero: 39; street: jektsdbliw; city: kzfqdt; postal_code: 12612,+2989619248; +2387702813,khwxrb; jlioc
6a21b1cb-3653-4519-ae06-678f6c5b3f52,uebcdslk,Female,1969-04-25,Dermatology,uiwpv@domain.com,pyxdvozgjrncleibqfau,numero: 94; street: ulbgaxnjqh; city: jwtogb; postal_code: 48372,+8273749916; +4617803334,wkglzd; aiwdk
30bdef11-d76d-4315-9650-6ad58a73125b,ftmspgzj,Male,1988-01-23,Neurology,mifpo@domain.com,gavlrdmxzjsunopqkiwy,numero: 13; street: qogckiuyph; city: hmeszo; postal_code: 42899,+4692909963; +1571765896,rpmevo; htiym
d91f716d-9b4d-4fcf-b63e-89534791b4c0,qldtpcyx,Female,1992-11-28,Pediatrics,gjkaz@domain.com,zydhconrjvefwtbpxkla,numero: 28; street: osagevztyb; city: olgasr; postal_code: 21872,+4527143564; +7114597498,pygchu; qajed
78d8b861-5f46-4392-b075-b840160336bf,ohjktgsx,Female,1961-03-15,Dermatology,rvhue@domain.com,fpyskuxagnzqltbmoejd,numero: 76; street: kgltvfyaqm; city: fnozqa; postal_code: 78298,+1930243106; +8485757747,urhxal; peany
1b3daabf-b91f-4ff4-85e9-fbc00fe53bb2,qcawprvk,Female,1989-05-08,Pediatrics,rzlui@domain.com,vjxuogpeqbicmrlyzdwa,numero: 86; street: ztmjqoanhd; city: owdqty; postal_code: 17500,+5499484391; +6126898571,adtkni; zidyv
44182308-b241-49ed-8dfa-54d254522c2d,xusdmblc,Female,1979-09-17,Neurology,pwoke@domain.com,yrptqcbzlgjxihnwfdus,numero: 71; street: skmurjbzyn; city: ahtngl; postal_code: 43053,+5203184848; +7581441312,hejnpz; sbvuk
a294979a-e636-4b4a-9592-bffc9506385a,fbinqkpl,Female,1984-05-11,Cardiology,cinhz@domain.com,uahgpksrdiwbzflnytjm,numero: 47; street: rfuvcbnxmj; city: xdyqho; postal_code: 72570,+2769506723; +2683606701,dzmljo; btvnl
3a49871a-29c7-4fc3-acab-82bf3acb65ee,ajmnglrd,Female,1995-04-30,Orthopedics,fexvm@domain.com,fylbwukvniroasdjeqth,numero: 37; street: zuyoegsxqm; city: kczquf; postal_code: 20650,+9318174273; +3215526650,kfzwjb; fyzvo
1892314b-2722-4143-9157-4dc3c9245faa,abdhjleg,Male,1992-03-16,Neurology,ujzfp@domain.com,ezvinabctluqdgfshpjr,numero: 65; street: ozahngyusd; city: dgzbin; postal_code: 77924,+1925973458; +2226886423,jhdtfm; genut
edda5a82-d419-42a3-8d01-420b4ccd0695,zmeiyhwr,Female,1967-03-12,Orthopedics,dypcu@domain.com,tjcbnhyvdifpwgkoxzle,numero: 62; street: cbtwsnmzrk; city: bfjiho; postal_code: 15799,+3761168702; +4230156469,ouaxwl; aflhb
ce48b155-48d7-4b89-8939-a0dfd9e5eaa6,ckxjubfr,Female,1966-01-20,Orthopedics,yhkgo@domain.com,xczgprkqjedbmtawsyuo,numero: 63; street: wleoxjkyza; city: zdyegx; postal_code: 34581,+5080835602; +5356542445,qvglzu; knrdw
19e02e95-dbcb-459c-9221-ed308a918f3f,famocwvk,Female,1973-07-18,Pediatrics,hkydo@domain.com,tfvkdijyeurmaglxbosc,numero: 79; street: voczugkbix; city: rtpevo; postal_code: 26711,+4876199335; +7748637441,gdowzt; cdogv
c58645f6-f8c4-446e-a09f-e297666ae645,hpbufjyi,Male,1982-12-23,Pediatrics,qscbl@domain.com,osypljztghwmnkubciev,numero: 50; street: rgtjmxdbfp; city: wdjioh; postal_code: 13102,+9049830196; +1797142738,daikmw; kypnq
197cde70-adf5-4f05-84b6-6e97a80d696a,hcjmylet,Female,1963-10-02,Cardiology,tprus@domain.com,wyosfenlkbghaqiucprv,numero: 17; street: nxouhlvgdc; city: jedang; postal_code: 72352,+7880704071; +1164676045,erlkmh; efmkq
70a71b23-73c5-4845-aeee-2db17fa7efa1,bwesagpm,Male,1964-09-29,Orthopedics,nxmzh@domain.com,pedcmywkghzrvubtfqij,numero: 38; street: caqsyvhpwz; city: apenjx; postal_code: 25993,+7786288542; +7650912106,gafzpj; bfeac
4986b35a-9e7d-4299-8a54-d192c936d83c,vowxnlet,Female,1961-02-06,Cardiology,gswhx@domain.com,baijxsmtdglfkrohzneu,numero: 81; street: yxrknuzieg; city: ftuyqm; postal_code: 65466,+2760544980; +8150408888,zoadux; czoik
17eb170e-cd48-44c0-8e54-eb1a5f482791,lytbrfjc,Female,1993-01-05,Neurology,loayq@domain.com,xsqchtezmulavngpbjri,numero: 71; street: cjnadyhigp; city: jpkomg; postal_code: 68147,+8416831009; +2854970334,rcflhi; upnyz
27498e23-7aa6-4f9d-98ab-062312746ea9,nruiacek,Female,1974-09-13,Dermatology,okqcg@domain.com,bijcnohwmyvuegdtsfkz,numero: 86; street: lxbagznkuw; city: acbfnr; postal_code: 58777,+3997479570; +4818552975,xlvqmu; yhzug
73a495cf-da59-4173-89db-5945516dce95,cqibgvmk,Male,1990-05-26,Pediatrics,txsyw@domain.com,cvhdwumrgpzkaostlbny,numero: 69; street: kleiufpxnm; city: xwrzbt; postal_code: 43749,+8572250008; +9066867330,uhgbel; mvinq
5bbba08b-b6c4-4800-893a-3211f8518a31,wvqdapky,Male,1982-10-16,Cardiology,kowys@domain.com,niowbxlypmzchrtugseq,numero: 3; street: vhwlyiezds; city: yofhcm; postal_code: 42374,+3506876129; +1373730642,wdehox; prcat
03b82370-4516-4fa8-a7d0-3e7f7bddd5f4,srhfpbuy,Female,1965-08-29,Cardiology,pnhia@domain.com,kjhbsmzldnarvegtfiwc,numero: 39; street: ojzmqlkitn; city: kqxbgm; postal_code: 76039,+7021673669; +3267622621,ngtuhf; tbvdh
ca03c6f8-4aff-4a54-ac95-27c8a87ca191,azgyqtjp,Male,1972-02-08,Neurology,vewcd@domain.com,aqkvcwfxrmgpediytzhu,numero: 3; street: mofjvtrlsi; city: aufxzl; postal_code: 90215,+4852631702; +5290629899,flphtw; gdwok
a052915e-dfcc-49d6-9ddc-dded65fff961,hofcwyqu,Female,1992-01-15,Pediatrics,mfspl@domain.com,pkyhwadvbjxofcmlnqur,numero: 28; street: hvqrwkjmsu; city: ifdxle; postal_code: 75976,+8502611436; +3245982983,qmyfxa; vjhrz
b146ce77-47e3-4586-9e70-3cfb988928c6,jgrxawti,Male,1983-01-22,Orthopedics,uhywi@domain.com,enuiaqpsdyztxobgjmck,numero: 82; street: mhnkuaxebr; city: zgspyj; postal_code: 68071,+6433727418; +4148126800,ncbget; ljntp
24e502c2-7a0d-4c36-abc4-580c045972ae,vyfbnlhw,Male,1976-01-02,Cardiology,mesjd@domain.com,gcxapsykqobnlrmihwdt,numero: 6; street: zfqbaovjyw; city: vliupd; postal_code: 28696,+6963896115; +6229743927,rtnbyp; xtvfg
0a0387a3-1839-4425-a9be-17be22b5bb47,qfhnoytb,Male,1990-08-01,Orthopedics,gnxrk@domain.com,uabhwkdqertfgnosvmzp,numero: 8; street: nxdwqhvrsz; city: fdyoil; postal_code: 89432,+5431859941; +3348116467,opjefq; rujpk
4bb1840a-e725-4830-af12-720c6fe52354,pklaoxtd,Female,1965-11-21,Cardiology,tfbvh@domain.com,biogwavmlszckertpyuf,numero: 28; street: bknfcwhzuj; city: nlfzvu; postal_code: 42339,+3086513016; +3828848093,hjpunz; xrdjf
1fff4ba9-9e19-4260-b399-3c4d62d088d8,gmldkbws,Female,1967-08-25,Dermatology,koyhv@domain.com,apmlvfktusonxjyqdihg,numero: 65; street: dnhacfslzg; city: xwlzgv; postal_code: 58738,+5387740490; +1606042462,njlfpa; vkbuj
64b44996-c0f0-4e2b-baa9-792143341bd7,wbrhksdm,Male,1979-07-19,Dermatology,nkolg@domain.com,wqkvbfeiocdxzypmhust,numero: 19; street: naokljwrpu; city: gtdozb; postal_code: 78382,+4066042269; +4319898337,kuojxv; skudi
49b7090b-6272-43da-9e33-0a95cebfd09a,gebvywjh,Female,1967-04-01,Dermatology,nqufz@domain.com,bwglyjmsehrznqupcvtx,numero: 90; street: hybqrdnlsu; city: pfwqxk; postal_code: 19108,+7756810912; +6176639202,wmtcya; yadgu
43a4ea70-630a-4f09-9258-3086d08862a7,cbtvwuam,Female,1980-10-21,Neurology,rbzpd@domain.com,rlcwqmnvsathgfzujkbe,numero: 50; street: jrcbxyelsi; city: ktxadm; postal_code: 78508,+4354582356; +2333712801,anrgbv; zetgc
68fcef1b-f0df-4818-8548-005b2a63c44d,mkhbzcdt,Male,1991-11-24,Cardiology,vxgsy@domain.com,zdbikhtpascqexurmywl,numero: 74; street: shyvxzgafc; city: szvqif; postal_code: 59393,+4626095693; +4048360974,wxfept; cduwo
7d016392-a30f-4a5d-9ea3-eda6e1cb5aff,smljvirp,Female,1967-02-16,Dermatology,hdzkp@domain.com,fxnocesmlqygbvutwpar,numero: 67; street: tpzkqrdiny; city: dseywa; postal_code: 87683,+4298481263; +9211429381,wecjmf; jalzh
5d752367-0146-4fa9-ae9f-7630eb94d726,jqsfnctm,Female,1992-11-03,Orthopedics,fbkod@domain.com,efxhigsonauwcvmjyqbd,numero: 9; street: ngjkeaxqtb; city: nfgyep; postal_code: 86592,+1155602060; +4407510492,cpjbyu; sexmr
f99eee8a-7c0e-446c-9958-607a56b82b83,zrxcjyps,Female,1968-04-08,Dermatology,csbga@domain.com,kdczlobutjevamnwfhyp,numero: 28; street: gbhylosaid; city: okwgum; postal_code: 60937,+3732698883; +7654894310,ucvmlg; clmxw
f14d7ea1-ef87-41f5-b1e8-fec29fd9accb,cxmapkts,Female,1978-08-29,Pediatrics,dfgnu@domain.com,basuzhkgedytmcqnlowp,numero: 94; street: wcyvbdeang; city: vdkrnq; postal_code: 97430,+8662563359; +7099670333,vldxoi; xwmba
445734a5-a1c3-4a4e-86eb-6ce6f750a1fa,bkpdxzoa,Female,1968-10-30,Orthopedics,puixv@domain.com,hdbvygjikplxwceansrf,numero: 85; street: bcigpdnjwk; city: fgevom; postal_code: 69443,+2807506538; +6196957496,flzuns; phgyi
435b4ae5-e685-4adf-8135-061f8133b512,qkacwijs,Male,1986-07-24,Neurology,grcyu@domain.com,wmpdxubkhzylivascqoj,numero: 49; street: kofrstgmzn; city: uhtvdg; postal_code: 80527,+6941781291; +5433294749,qvirca; bpqoy
ead0e0f7-b3c1-4e2c-9926-7e59f264572c,gequinfr,Male,1981-12-20,Neurology,blroj@domain.com,ykcvlzhjdofpqesaunmr,numero: 41; street: sfuwtgivap; city: smbwhd; postal_code: 57118,+4248642817; +2554192361,tdqkhl; pjlwm
5add5a3e-8150-400e-83ad-d86ea96587a3,tyephvlj,Male,1993-12-28,Orthopedics,dqabh@domain.com,cjmqafgvnwskyidoebpt,numero: 73; street: kcpstuvfag; city: kdxtqe; postal_code: 60798,+7682152914; +9682454785,tkgxae; rmesb
42ed6d97-5fd6-415b-bbc9-48b9d3dcbd0a,cqpxviuz,Female,1967-07-13,Pediatrics,nrzqb@domain.com,wycstqfpgbxzeinmrhdu,numero: 46; street: bfxhkdspan; city: kjwdol; postal_code: 60814,+4156228852; +6424728092,czpvwh; lvqtd
b11aa466-aa63-4d2d-aa24-5bf0e5f71d9b,agrcuvti,Male,1967-11-05,Cardiology,jcmdy@domain.com,gmbnyvpisculjzfaerth,numero: 43; street: bitdmlvszy; city: rivkjh; postal_code: 34769,+6267935613; +7258833893,kqndma; yrmlu
56c8ef32-0c44-432e-8bdf-17a6f3340860,quiylvwz,Male,1967-06-22,Orthopedics,hdaxy@domain.com,mpuexidwyfqscgjholan,numero: 9; street: mtnrbuhgfo; city: ubhcak; postal_code: 89793,+5008549623; +2549607672,stlbwc; gnotv
d8d23b85-f9b0-417c-8ddf-395821880e3d,kxrfqbjn,Female,1982-06-15,Orthopedics,bpjoa@domain.com,obxldywszhkcnmaqripv,numero: 42; street: hqbyfkjnct; city: yjznkr; postal_code: 15742,+3561001339; +5284744538,mdhbkv; fpeus
a7e84bbe-d751-45c4-a8b8-ba4ae516dd98,ftdjgpyo,Female,1991-01-06,Neurology,mnayp@domain.com,zqsrmkfpavoxtwcydnhj,numero: 25; street: iqlpzhfctr; city: yqiusw; postal_code: 39580,+5942608969; +2902277157,oztipg; jxhtk
d3d18f48-b652-4552-a54f-72b59d010ef4,bjxgpkzt,Male,1962-07-07,Neurology,ozvhg@domain.com,glhafbptwncjvyqzuemi,numero: 27; street: iajyldnmwo; city: nkighp; postal_code: 82961,+4813019686; +4764983140,pcezqr; jtdil
0a8626f8-7d80-4aa5-8695-147e834863ac,dkaqulje,Female,1994-08-23,Orthopedics,otzcd@domain.com,emrlfxuispzcbqdowhyv,numero: 5; street: fgmlvjnotd; city: kvqwzn; postal_code: 36480,+7100888165; +9872935207,txdirg; thnpb
ae30ba4b-d91e-44ba-9b14-1d0d0d3f28fa,vlogzaen,Male,1968-05-07,Neurology,wdhzy@domain.com,tafinezopuksjqrlvdmc,numero: 71; street: cpsrnmvdil; city: rzaopw; postal_code: 28662,+7341412185; +2276959876,ziklwj; vynws
cebd6a43-b688-4518-a21d-8c877d3c46da,vkhgazfr,Male,1976-03-02,Pediatrics,zraui@domain.com,gbqzwyicsmlaerdnkftv,numero: 1; street: ujapegndcv; city: tgzipc; postal_code: 48780,+9864370234; +5914632817,jnsqyh; hrxbq
8a6a747a-0960-4776-a962-978b4bc7addf,khfltwaz,Male,1978-06-26,Orthopedics,fuydl@domain.com,zrlijycpbvnawmgofstq,numero: 90; street: bvrdszugnt; city: xainqb; postal_code: 88181,+3155489137; +9613676474,dlvaoj; pznaq
41c7caa1-02cf-40b9-a11c-96159e058f3d,udslqbze,Female,1990-05-14,Neurology,xzurh@domain.com,gufdyaqevwpczibsjrhx,numero: 89; street: mlrenugjid; city: atxicv; postal_code: 45273,+5856021990; +4722852376,hqgsed; jkgui
1ac1ba43-1df1-4a1f-8047-3391a4270d85,yisuvgbq,Male,1980-07-01,Cardiology,hynea@domain.com,owipjqvdrteynfhsckgx,numero: 44; street: optfajiqxn; city: mgylqd; postal_code: 95233,+7392417210; +4199819600,mteqkj; xkfrq
656dcd22-3905-449c-aebc-67c3276109c4,zahybfto,Male,1981-08-09,Neurology,lawdh@domain.com,jomepruighdqtwbaxcfy,numero: 31; street: lcsrgdbeth; city: alhgek; postal_code: 87670,+6498784094; +8061312494,glmpsu; mhclr
4c173e11-4ad4-4faf-8017-cb281c907f18,knsxvpgt,Female,1987-06-20,Dermatology,yuzpf@domain.com,pjvtngeqkdizworcfxay,numero: 47; street: eqgdbzfltj; city: ubncrj; postal_code: 19830,+4714751343; +7833277508,hwmiap; hwajq
89894949-3fe1-4610-99fb-0211976d857f,izcuwamb,Male,1980-08-04,Pediatrics,ucvrd@domain.com,bidmovhtwjzlsnyfaguq,numero: 66; street: srtgupcxen; city: corxyf; postal_code: 96818,+2829351963; +8199802243,obzcay; nqozs
bfad9a34-8325-4e8f-a319-2b7d7e87eb0a,nlywvpmx,Female,1974-06-19,Dermatology,yumil@domain.com,epwlfzgovcnjxhmuydts,numero: 53; street: hmbpxzvcfn; city: kdxlma; postal_code: 69796,+1616682276; +6756465218,zrsluc; pdetq
2f14436d-1d35-4c49-bfec-b5792fc86809,hbuekntm,Male,1974-04-17,Dermatology,gweuj@domain.com,bfzapjliwgmqkncouxhd,numero: 88; street: jrvlncwbso; city: qytkev; postal_code: 22958,+6360335485; +8486198782,stlqmo; xblgs
502cf0f5-ab95-4de8-8bee-e6ebb8e9a404,fdqkjnab,Female,1968-09-05,Cardiology,odrsc@domain.com,rfkpmxbeudzjavhcsoiw,numero: 38; street: kjeusmiqyb; city: gijaus; postal_code: 24557,+3544841054; +1701465668,byrfwq; ujwxb
ea624410-4918-482d-99ca-bd6ca8e7279b,lthwxqcg,Female,1979-11-02,Dermatology,gydro@domain.com,nizhypfrgxvdtwmebjkl,numero: 9; street: ftaqoikhbm; city: kbpazt; postal_code: 33847,+3153930847; +8315245431,ejglqs; tvqog
777d51cc-9244-404f-adbc-72020de4aedd,gdjwpmlt,Male,1984-11-11,Orthopedics,rqzaj@domain.com,ixuehrmzdtpfcqabvslj,numero: 89; street: vhctafkpli; city: ilomxv; postal_code: 99387,+8721393082; +4025786102,shzabc; hgdet
1601fbc7-7c65-484e-b44e-41cf1cd4e53f,nujdakhp,Female,1995-02-11,Cardiology,yseko@domain.com,ekxugdrihtqasjznmyob,numero: 81; street: mxaguivrlo; city: uqhfen; postal_code: 75257,+5665433621; +9855345756,arnvos; xmaeq
de3b50e9-3e33-4e9b-91cf-51a68ffd83e3,puxiecfo,Female,1977-07-15,Cardiology,xqpwn@domain.com,tzvqiplydrgxeswohcub,numero: 11; street: nutzgifmao; city: mbyhxn; postal_code: 73660,+8873217165; +5321934222,ojsudz; tpabc
23389fc3-7191-46c7-85c1-f102842e06d2,ewqjifsd,Male,1991-10-17,Dermatology,qnytj@domain.com,hrwjdefpxyntibuvglao,numero: 52; street: ktuanjvqwz; city: ukfdzi; postal_code: 45457,+5448306403; +5120393820,qeflrh; zwuoi
77b6e3f0-e2e2-4cf0-9512-8b09cc2abf1d,udaftnlr,Male,1964-04-15,Pediatrics,mwoaz@domain.com,sqcdmyevhnxfglotrzkb,numero: 95; street: erzvtlsuho; city: iyecgj; postal_code: 42275,+6069470884; +5446054307,olwtux; vknih
4b1c8cc5-9fc8-4b72-b7c5-3d5cc87f9e1b,yohzewxd,Male,1961-12-31,Neurology,jdche@domain.com,jrfytblhkwvmcensqpdi,numero: 33; street: maigpendwh; city: darefc; postal_code: 75673,+8782557006; +8881437600,kaohbx; dzqli
8996c671-d517-4dda-9443-0b19f26b38a7,sxinbwzp,Female,1963-09-06,Cardiology,ikmot@domain.com,skpnyoqmdutrhwibjazv,numero: 99; street: ryzmjgkntc; city: gyqbzd; postal_code: 77031,+8616536800; +4216895665,fmrqbw; kpciv
231daa5e-8ba6-44f0-864f-f87d6c13e15c,xgoipqkr,Male,1971-11-01,Dermatology,dbuih@domain.com,mrhwkzepsfbdnvyqicxj,numero: 11; street: fpshyltemn; city: uznlqi; postal_code: 46691,+8611513447; +8887197968,baxhpt; udgcj
213059d1-8224-4e90-90e4-a0479da81de3,snqchpym,Female,1987-03-31,Neurology,juvok@domain.com,deuxjibtnwclgrqyovmp,numero: 60; street: bfxjplumgr; city: ybxkpr; postal_code: 27581,+1182989019; +5083069357,bewkdz; scwvq
8cd0041f-2bf7-4638-af3a-d559356d21b0,ezdontub,Female,1965-01-11,Orthopedics,gwpnx@domain.com,ulpwxfdsoyaieczqkgtm,numero: 7; street: wvjezqgotr; city: aoydlr; postal_code: 33832,+3184176079; +4268922082,kvbcio; heojn
a8d8012c-b089-494a-9e93-046b6467a6bd,xlfebzvo,Female,1992-06-29,Cardiology,kdqpy@domain.com,gitdlcpnuamfsyhkrxvj,numero: 26; street: jtxcghwsar; city: vlgwpn; postal_code: 94178,+6151545965; +3517036731,zdsvwo; colmb
5adba2ba-e7b3-4a08-8bb1-10772225aa8a,vyxjdwnt,Female,1988-12-15,Cardiology,zcjla@domain.com,abrdqijmztkyxsefuwnc,numero: 92; street: ehlxzmobga; city: jkbimt; postal_code: 84107,+7559238892; +5124882969,yndowp; xwnrd
9d9a5bbe-1100-4e6f-8def-c659fa03694a,jdnlsxwy,Female,1977-02-02,Dermatology,tkowj@domain.com,gapdrincqyosumvhxktj,numero: 19; street: famqjkxswr; city: djzkyx; postal_code: 60103,+1524295369; +2692388234,bfmozv; wuiml
eefe4bb4-c917-4a07-a844-f64d9a91fbf8,vbfqypdi,Male,1971-12-31,Orthopedics,byxdo@domain.com,aihbunjckyvfgzedltsr,numero: 34; street: mdqtyzjspi; city: jrpsyx; postal_code: 23008,+6208520958; +9697182376,vbcilr; oknrb
cc796cf3-f1bb-4404-b417-515718c6b726,ywkvbhau,Male,1987-01-03,Neurology,ivhlb@domain.com,sdgqkwxfnpurboimlach,numero: 12; street: gtmjwaveoh; city: rvtakq; postal_code: 88533,+6712977989; +7287063892,slhvcr; prgtb
3f8103c5-9518-433c-a8c8-f537a6beec25,axbqirle,Female,1985-05-06,Dermatology,jrklx@domain.com,njrfgxawyutelhqkdicz,numero: 20; street: ebapsmkrhv; city: avbjgs; postal_code: 60024,+7967200505; +1901731221,atigvb; gjwxn
5d1cb08e-a2b6-402b-98d0-ab76da09a811,yprnvtzc,Male,1983-12-01,Neurology,tgazn@domain.com,djhzotmueiabwpkngfvy,numero: 26; street: mikerjohga; city: jsznmx; postal_code: 72501,+3345384768; +5239780455,oymhqw; tvbxd
a1914152-6637-4b76-9e87-fa37ef77263d,xmignqvy,Female,1977-12-17,Neurology,yqshr@domain.com,mnkavpzxutbhyljiredq,numero: 42; street: gatbsfxowc; city: bkjuxy; postal_code: 38403,+3047978869; +8369786415,pmahyw; artjs
a9f375f5-d154-49b5-811c-8652b19ec689,fstiedho,Female,1993-01-25,Pediatrics,moezi@domain.com,rsqytaxiownzdmgclkpe,numero: 12; street: yzondcfrie; city: rdcjnk; postal_code: 56835,+9844285780; +1153422992,ltqmua; futer
2d8fa903-f4f7-4a3f-b796-34f38699d8f3,nwjdmpok,Male,1960-10-27,Dermatology,mdsac@domain.com,wdcaybniqplhzksujotf,numero: 95; street: zpgfwrtmes; city: rjcvdw; postal_code: 98791,+3154058197; +4343663818,aypfor; febyg
2f688d98-32c7-497b-b2bb-40d246dcfc2c,qfbwkcea,Male,1981-05-21,Neurology,elnzo@domain.com,knzuytcjvmaerlbfxgpi,numero: 47; street: zdqfysirax; city: ihvqtg; postal_code: 48537,+2470284179; +2891066754,lruaqk; zxhrm
75a37945-4ce1-4a34-b2bc-5ca3deb76c99,ovulpcwf,Male,1965-03-20,Orthopedics,eabvm@domain.com,odqkluhwnmjzifsgexvy,numero: 59; street: ugwcnfijdy; city: jymnhr; postal_code: 85536,+2347935576; +8970652701,asfmwk; yabhd
af286515-1927-470b-8726-6248ff420f1d,jctpywvb,Female,1965-04-10,Orthopedics,wkexq@domain.com,mkojqhgyutnzsepvbcfa,numero: 30; street: kfjcrpzdlv; city: eguiab; postal_code: 55600,+6904884720; +1577397705,ebdujk; dzinr
84e22484-c6b8-40b0-9265-a745af8726a6,iogyhkzj,Female,1961-07-17,Dermatology,bghfw@domain.com,juydkshmvpacnxirqfwz,numero: 13; street: pifygvbdra; city: dkxcjh; postal_code: 14120,+9567541165; +7516303955,jwderx; zifbj
9040532a-383c-4770-b281-dc1be1ca2997,wnzumtah,Female,1981-10-19,Orthopedics,cxqgv@domain.com,paovxfelzsutkmwrjhyd,numero: 74; street: echrvnfgiq; city: nkhczw; postal_code: 28351,+4643166327; +6715236792,dkbelm; qxbrg
6400b55d-3737-4245-b553-ae76385d1fd2,frijadhl,Female,1971-04-01,Orthopedics,rqyek@domain.com,nzgetjpmakdvbfricuho,numero: 64; street: ixecprsqbw; city: ukeybj; postal_code: 12224,+5649451077; +5871583649,dbagzv; iptjh
3e37b8d5-a8cc-45cc-ab0c-e65d47dddb9e,zkfhgqao,Male,1971-08-23,Neurology,tchzu@domain.com,kzxuwsyahebdlrpqjfmg,numero: 28; street: puesjahczl; city: dxjste; postal_code: 59913,+3421029033; +8290498728,mlrtez; tvljx
1a7b9ee2-cc4a-4b1c-98c9-ca6972536eea,lcgqrjtu,Female,1986-06-27,Pediatrics,whqnj@domain.com,drzkasbemqclyhnuijfv,numero: 63; street: lnxuvmjeqs; city: upexij; postal_code: 48470,+3216639525; +8344523576,xcgwim; tnsuq
2abbb7d5-d915-4ffa-af48-0873404cd8d7,qdmkxytn,Male,1982-09-24,Dermatology,htaev@domain.com,myswokinhfdzejqvpgcb,numero: 33; street: lsfdvkwbea; city: geovwy; postal_code: 23916,+5073907389; +1575536666,tlxrvd; hdlpc
d2689f62-be52-452f-81ab-f3bb05ec8b91,hicmdasf,Female,1968-12-24,Pediatrics,kixmp@domain.com,yqghdbfpnwjrmavtozks,numero: 56; street: imckfxrbza; city: udbazr; postal_code: 99287,+9005094940; +9054742458,reazdw; hwyvf
7f7d0327-b913-44ae-92f4-fdfb67aa43c6,mrbpfsod,Female,1965-08-18,Cardiology,bmekt@domain.com,bwirxvdygsckfemzlhap,numero: 6; street: aypzehslni; city: thbgrv; postal_code: 44038,+7755890254; +1671568829,fmtycp; ewskj
5ca7d416-704e-4aef-b758-831bcb96a257,vfgpdeqn,Female,1970-07-24,Dermatology,hoiwk@domain.com,tkwauzheonicvxdmqlpy,numero: 68; street: wnugaxsrcd; city: bysfjw; postal_code: 78309,+4502056173; +4210988716,qlpjtb; dsobn
e403db64-6cb8-49fc-9911-87109d943fe1,dmagcrnw,Female,1984-11-13,Orthopedics,hlwqf@domain.com,ibezxhqlguapkjyvnsrm,numero: 19; street: bsychdezfn; city: rwnjab; postal_code: 88192,+4680627217; +7380716312,axvmdy; dnjuq
02d56138-ba79-43fc-a5ca-42b995abf4f1,rhvxmlof,Male,1995-12-30,Cardiology,egnfd@domain.com,mprvnjdyehfsoatwbcug,numero: 20; street: kteqrcxbmu; city: kyowje; postal_code: 36890,+6033662904; +9604173693,insfxm; bwmoi
0a4178c9-5ab1-4163-a85c-195eb8e9d998,pxihdfnl,Male,1987-08-19,Pediatrics,dnmvc@domain.com,kewpltzqnrsviycafxdh,numero: 70; street: flezypkdoc; city: jcorih; postal_code: 31483,+2241126740; +5858779368,crhdpw; xakdw
c7bfdce0-85e6-452c-95d3-74385ab7692f,dtwvfbux,Male,1970-08-12,Neurology,mwtbo@domain.com,sralogmitpyvbxqjechu,numero: 96; street: ynqwtgrdfs; city: mkcyel; postal_code: 80213,+9109451015; +5698672232,spyuxe; vjglt
1f7667e1-6df4-4b43-af4f-4ea9729fd301,igmljapr,Female,1995-03-19,Pediatrics,lqrpj@domain.com,hmojygsdzfbxrcaiwltq,numero: 17; street: qfmahdgjos; city: eugpjt; postal_code: 56809,+7813903489; +5031545025,givopl; ntfez
154feaab-94d6-4850-8faf-c79a5e240c05,qlayuvxf,Female,1992-07-17,Pediatrics,ifrhp@domain.com,iodhmjsyvalcbgzwqtfr,numero: 95; street: qnsduhvmjc; city: ltykxg; postal_code: 18856,+8227721303; +2020697080,wxjrvk; akqxo
8bd7b037-a196-41de-853e-3d1e1fc3f33f,fsqogkih,Male,1978-10-08,Dermatology,gxfpr@domain.com,qbpyvlifwuntezsogdcx,numero: 69; street: dqkcwbtnoi; city: sxwtjy; postal_code: 13105,+5627883409; +2772104886,diuoyv; fkyqw
8ff2bb2c-2424-47e1-a757-4796cafaf931,sibflvkr,Female,1974-05-28,Dermatology,vmlsh@domain.com,lbmutqgkzihcndrpvawe,numero: 2; street: emxdjsalon; city: abmpyg; postal_code: 38106,+8599284737; +2126173700,qnrice; wolam
a3526a77-40a5-4934-8b68-e5de4675dc07,zhdynmfq,Female,1986-02-05,Dermatology,cpaje@domain.com,hcmredniybwujtlfxpva,numero: 16; street: cpkqlzxmfe; city: cxogyz; postal_code: 41339,+3943912237; +8135818359,imdtbe; rmzfh
218b01ed-c58e-4256-8df5-8151f181a98c,ugmlrisa,Male,1981-10-23,Pediatrics,rgblq@domain.com,dhcyvekiftazxjspwugr,numero: 13; street: hqzuxtnsfm; city: wmuxpo; postal_code: 14297,+7618785494; +8300773704,wqlnej; fbsrw
5d5394c6-2a23-4c95-b388-4f26501a22d0,pcmotjyx,Male,1985-04-16,Neurology,acrpe@domain.com,qamvuzyloikxrgbftswh,numero: 91; street: idjfsulhgx; city: txvprz; postal_code: 94388,+4620939005; +2013714909,rixmca; ftipv
c234831c-9567-4a36-b00a-cdc9c92d743e,cswiaxuf,Female,1961-12-06,Orthopedics,xgloi@domain.com,yvnaifbmetwxgslhukcz,numero: 18; street: uroczvgqkw; city: itlawy; postal_code: 46261,+6761299771; +3885909862,jntlyr; ceokl
46790ae8-0d4c-4852-87c5-a01e9ddeb407,ishxpwzj,Female,1991-03-05,Dermatology,yquvs@domain.com,dzbgctjqnfhmulirkawx,numero: 62; street: iqpnyevxfk; city: gdfsmh; postal_code: 78335,+9824423027; +2672153123,tirwgh; nubav
