id,nom,sexe,date_naissance,specialite,email,cv,adresse,list_telephones,list_prenoms
720a6a3d-609b-4f7a-b08f-f4de8e2f7577,gfdlpkhu,Female,1989-01-18,Orthopedics,autkw@domain.com,sjdhwmbnztruqflpaoce,numero: 7; street: ijqumdrbhf; city: szmrdi; postal_code: 73413,+8494703210; +9342381693,aqomdx; tehod
cec94e0b-e53c-4383-9f2c-47433c4b31fc,cbvurzxw,Male,1976-09-26,Neurology,zmbat@domain.com,gyhjkdaxelomzcvpqtwr,numero: 10; street: vawontremy; city: govqyc; postal_code: 19968,+2315946399; +4112467364,pqvjuk; xahyp
40797942-2cd0-4240-902c-99340a0f7892,jywfzpkh,Male,1990-04-05,Neurology,eutom@domain.com,suanrozelqdvhkfxwbti,numero: 79; street: fozsjygqbu; city: nqrtvw; postal_code: 40897,+7637407003; +1069284476,wpyfou; ulkox
35625656-5168-40a7-aff8-79dc764ad0a0,uryxipfl,Female,1974-04-15,Pediatrics,vbhpk@domain.com,kzjecuwxdqrfyiamhovn,numero: 34; street: vbjdpwfecr; city: fdkynx; postal_code: 29177,+3324578629; +3608899325,zxldhb; bdjyi
2bac3783-2b5e-48db-8ade-c724a50d80ce,vfqkeija,Male,1962-04-05,Orthopedics,tudby@domain.com,lctwkiozahufrjnsemgd,numero: 13; street: rxgacdbusv; city: hotukm; postal_code: 54234,+2805342067; +2341731217,dfbsnj; hwzsb
399411d6-cdb7-4a84-bf35-3c2457635002,nehdlwxf,Male,1960-04-13,Neurology,kalng@domain.com,ucntlrjyxbhezvaidmof,numero: 80; street: zxjatvsgwk; city: njvito; postal_code: 97274,+7913331158; +4724695710,gvmrtn; axvnl
16d2a328-045d-4145-90c9-9f0563dfbc84,fivbrdhe,Male,1965-12-03,Orthopedics,uenml@domain.com,ioxraygplftudqemvshj,numero: 85; street: cnrwlzmjap; city: qkdcih; postal_code: 29356,+5736154920; +6408586733,chsxot; tkwpv
5536f2ab-9981-4c37-a8fb-cbbcbe5079ea,tjlkoqnc,Male,1972-04-24,Neurology,vjelm@domain.com,iezrkgqpayxvsmfhwtbl,numero: 3; street: qryuvlpcaw; city: yuhble; postal_code: 90413,+2244899228; +3067919767,klduqf; kwomg
b66652af-2d32-4b53-982a-814784726753,xwmpubye,Female,1992-10-25,Cardiology,nsmwv@domain.com,stmorxzvkycjwfgheuba,numero: 94; street: zktsjxvlqb; city: feavcw; postal_code: 44883,+5663288330; +3262142062,mndsjw; lfgjn
235c293f-d412-4d6f-8383-950b0e6f3eb0,wtidjbsu,Female,1967-11-13,Pediatrics,jsrbg@domain.com,gwkrspvuyafjmntxbldc,numero: 38; street: svfdmcrwzb; city: ydcaql; postal_code: 42076,+9568585400; +5864095519,sfridh; nzbyp
c99a7390-d55b-453c-a9c9-32b3893dde2d,thgojady,Male,1992-03-16,Cardiology,xmzuw@domain.com,evdfpoxrsykilmbhncqw,numero: 37; street: ozngetfhjx; city: yzfwnl; postal_code: 75718,+3783249816; +3736479359,zfemht; mblys
958daeb6-8dd2-4a8a-a05f-609e2cb67a00,zwtahnrq,Male,1994-08-17,Neurology,nuvrq@domain.com,kltsqrjyhupbvewomdxc,numero: 23; street: xvbpsuocrt; city: rglezs; postal_code: 48561,+7826618924; +7183866337,awsrtq; nvcgb
dcec7559-4007-4860-9a9a-cca1489ff270,lemwfaqz,Female,1966-11-07,Cardiology,gnkiy@domain.com,yxjmupvoiqzshlbngktc,numero: 33; street: ugmipnholy; city: jpschq; postal_code: 13230,+5321524283; +2106585247,brmlyc; vjdlq
620130b1-d130-4a71-be18-0c073189b245,gtaruiwl,Male,1968-06-23,Pediatrics,ygzbm@domain.com,aeobtcgfnwjpyxrkudvq,numero: 6; street: uqksonrwpd; city: ufxphm; postal_code: 72481,+5623541405; +2853848745,xayrzg; lqmsn
0170dd4b-95c2-4a36-bf06-82c1101b4ada,rvcpiyoa,Female,1969-10-29,Orthopedics,orzgd@domain.com,lhtbyxgiwmuqnrpdjksv,numero: 51; street: erdylifutq; city: fkyeil; postal_code: 42408,+7124713148; +4933325024,cqljow; knjie
4c477563-6283-4185-a3d4-6adf299ad504,sqtwgoje,Male,1992-08-29,Cardiology,goamb@domain.com,tkazjvundsiheqopmfcy,numero: 87; street: dfqtrmjywc; city: trmdcf; postal_code: 27002,+9380829660; +8021007943,pwmxqg; cxgru
de92c8f6-e047-4a9c-ae1e-20751bbf92f4,iwfhmrxj,Female,1969-01-30,Pediatrics,lmyjb@domain.com,iardctlsfpebknjxyuwo,numero: 75; street: sqvtymopag; city: ypolbc; postal_code: 13238,+1453429027; +2801248992,tajzhs; epdta
5efe0098-1ba0-41fa-af74-8941e746dfcc,gaynjsqz,Female,1984-12-23,Dermatology,irnzp@domain.com,uyelzqginawhoktcjrfs,numero: 54; street: axprlbndwi; city: jvtbew; postal_code: 16446,+3508509486; +3871891885,ngfvrb; tuvdw
a30f1909-0fb0-481b-ae3e-148def73bf9c,xsljtbzo,Male,1967-06-29,Pediatrics,qeaks@domain.com,zanyjfpwrudogxceithv,numero: 3; street: mysbtjgprl; city: cgesiz; postal_code: 61112,+7457933795; +5717501712,lvwfhk; tcwji
97887e6c-1a1f-47f5-b6fd-cb8628c6087c,rqbmuxpn,Male,1975-09-20,Dermatology,adqpc@domain.com,ctanohbzfyelxrqdgimu,numero: 41; street: iqjltnpdwr; city: ygxbqw; postal_code: 34617,+2305096999; +8567075436,ncmwhs; leuvr
c48587e5-e414-4b88-ade3-283a048cb345,nzcfhabm,Male,1961-09-05,Cardiology,znedx@domain.com,dxzcprmlukqbswigfynj,numero: 1; street: jybzvipeow; city: zolcds; postal_code: 96642,+8663662205; +3753536019,tfjucv; ihlxe
d046abaf-349b-4041-9323-1924d28b448e,pmizufyt,Female,1986-03-05,Cardiology,siore@domain.com,hpacykzdjwoefmvbtlux,numero: 71; street: blspkmctjd; city: tjnaur; postal_code: 48994,+8714156966; +6025866913,efmchr; nudcm
816f93af-910b-4ca8-8900-d70ca7c20eb7,pcfzrxgt,Male,1976-09-17,Cardiology,fhewc@domain.com,afjezgltnmkwhiqdyubs,numero: 51; street: oqrmasnjkv; city: msvutz; postal_code: 62588,+7668346913; +9368640917,cjzqeb; gskzd
31d4a448-4295-4c3a-82c3-dfe1699989b3,pfbcnwod,Female,1986-08-02,Pediatrics,vebtn@domain.com,idhlytsafpqozrwbuxgm,numero: 40; street: qvuomknhdj; city: qfkyuo; postal_code: 28382,+4754654826; +2408915489,xkgeha; xyvmu
3c3a7b47-0419-4ae2-b4f7-8711439e0054,djmhfcyi,Male,1992-04-23,Orthopedics,qcnpr@domain.com,diajvhlzkywetspxufmc,numero: 66; street: whzfgxkcjm; city: hwegdm; postal_code: 79511,+9678455610; +2946755694,zjiecu; gnsbz
ae65ab26-851c-45a9-8068-05a82bf99e9b,zxyqctdr,Female,1995-01-04,Orthopedics,hpofs@domain.com,dhktigpmsljnqcabyuzo,numero: 26; street: fvqjxaukmp; city: oxayef; postal_code: 73058,+2691897134; +7784099140,piakjr; spyja
4afe3a2b-39b7-4eb2-a438-a204cae84693,shytuoxe,Female,1964-08-23,Cardiology,ognld@domain.com,kpytvheufjdozagxrscm,numero: 17; street: fyqnhbwzox; city: iwjfze; postal_code: 81997,+1518375036; +9259443576,etsndx; abkgp
0df6a6aa-60dc-4df7-8d88-14cf048735af,mrtbwjad,Female,1968-12-31,Cardiology,bxvnc@domain.com,tibykhxcspgmwfojanlv,numero: 48; street: pntqehdogs; city: ltpjdr; postal_code: 63365,+6192399775; +7567001292,chbqnx; mswvg
6bc417aa-7a91-4c68-a771-25600f58df0d,zviqwkxg,Female,1979-06-17,Dermatology,fgykx@domain.com,uwerqoachdsxgftvjibl,numero: 9; street: megidwaylq; city: uihycv; postal_code: 13600,+9236729245; +9082261970,rsexbz; xqhya
255caed5-ef13-4385-9a1b-afbf995aee91,japxwzgq,Male,1972-09-22,Pediatrics,dtcog@domain.com,hqoznmyxkugwjldrbsiv,numero: 81; street: vbgmshunap; city: aojybn; postal_code: 46042,+9822334192; +8995971624,pugyzv; udoag
1c727a02-1a56-469b-8f22-ba03cd505e7f,kgvizqoa,Female,1986-07-03,Cardiology,pfwbq@domain.com,tozcegmnlfudbkjqyihw,numero: 22; street: itncfygvpl; city: ewljsq; postal_code: 79070,+7629190934; +5505187948,pmefzq; dczyv
1b47d259-e3c8-4a24-8c0b-54dd57b6cfb0,xyvsdjzq,Male,1966-04-02,Cardiology,ivrgu@domain.com,krshwcavypdlmtjfbxqz,numero: 13; street: xifajgcylp; city: ltiagh; postal_code: 63887,+2632678886; +6671621508,wyiust; tjxgc
4ff8e3f4-af14-4a6e-b5bf-42fff19039e9,jzctmpkr,Female,1961-03-20,Dermatology,ptsqm@domain.com,yizkwefvjulhmsoagtpn,numero: 29; street: xnpvgrsbki; city: cjrtnp; postal_code: 22744,+2035011168; +5885974896,nhpdao; fiycg
f883b696-af77-48ab-bc7e-75e820583ea9,alokiphs,Female,1983-09-02,Pediatrics,xmpqt@domain.com,irmfqwblodvextksguaz,numero: 24; street: vfioygsdju; city: gbwehl; postal_code: 33642,+1673378192; +9984410626,mkjgph; wjuas
1c9de7c0-a67b-44e0-a7fc-515e5fa0e5b6,ofzjmbha,Male,1981-05-19,Cardiology,qyumg@domain.com,dcrkqepzlfntvhbsuxyj,numero: 29; street: kxgcvawbsu; city: shpboe; postal_code: 26984,+1807047709; +9767775215,thlfbp; zomgf
ce377ca6-749c-4df2-90c1-82327414d1a4,ozsjatiy,Male,1967-10-26,Cardiology,hckqv@domain.com,zkxgpaevlwjsrbcndquy,numero: 50; street: kglahpsbev; city: bazvid; postal_code: 21349,+9025662555; +1036603863,eyhsiz; njkgl
9cc1f9cc-2005-4fe9-9081-5c1186c5a8dd,aewkznmt,Female,1990-01-04,Pediatrics,tswqk@domain.com,vghlkizatexnrfbupdjc,numero: 57; street: rbgclheopk; city: nwepvt; postal_code: 25922,+9454340042; +2072944451,mxbhto; qnmua
d8d730e2-d9f4-4843-bbf6-e2a292be85bb,rlpaehxu,Female,1989-08-18,Orthopedics,zgbmw@domain.com,axtwqgorbezpyvcmnsfi,numero: 43; street: tdiwzrjmnh; city: zslumy; postal_code: 11768,+5975179660; +9485547566,gqnlrb; axmzk
6571767e-eb71-4079-9723-9794530aa2da,qycanexb,Male,1974-07-08,Dermatology,xkufy@domain.com,wxurhctjqkobdfplzeng,numero: 32; street: evuoykitld; city: xgapnv; postal_code: 52278,+2803955146; +3558438827,axfrjg; eoibk
2d092980-4614-42e9-82d8-2f3ef46c0316,admbizwf,Female,1973-04-25,Neurology,buegw@domain.com,odpwvhrybtculxjqnaek,numero: 83; street: upafmnydeo; city: nrgquf; postal_code: 23673,+1844009126; +4271321703,lwsnue; yetvl
ed783838-45b9-45b7-9614-2d3f45781c66,rmnyapdw,Male,1982-09-01,Pediatrics,jlkza@domain.com,sghkbdjacmlepwnqytui,numero: 75; street: tzroskwgyl; city: rlwmbg; postal_code: 23300,+7911190972; +9011955729,rbozif; okxty
ebca31bc-6705-4554-8b57-58741c1db351,ylkitpqd,Female,1990-08-17,Pediatrics,ozcdk@domain.com,ayweiznkdcqfsgrbpvlt,numero: 83; street: ymaiejlhqz; city: sircwh; postal_code: 80153,+7012127295; +2473063048,fjgxtk; bftsm
62628e84-4137-4799-a8c7-acf3cd9b7f77,uhbxcirw,Male,1960-06-18,Cardiology,lsfwp@domain.com,tzgckjpqsdbyihfwveor,numero: 49; street: jgdezpbmot; city: dbpvhx; postal_code: 80763,+8444224841; +6490638871,rkmovj; fnsku
6eadde9a-7a0a-4303-96b5-653e97ab7089,mdfkvuie,Male,1995-01-27,Pediatrics,xjyrs@domain.com,rtjyamebvchwpixqguoz,numero: 37; street: jbtxaglqvs; city: dqriht; postal_code: 39010,+2924013878; +5041111457,uikfvx; yqdjw
d626cb45-eab0-433a-b6f6-42b4963bc285,gufrqmcd,Male,1970-11-29,Neurology,kxuto@domain.com,gsqplmyvbornieujathf,numero: 37; street: qazhvsbjpx; city: jubtqf; postal_code: 81910,+5566350774; +7825374557,rfwcdp; egfpt
831f43ef-45ea-49a7-9e0d-189a26cfe170,msetuicp,Female,1962-09-07,Pediatrics,zkhls@domain.com,tkfrvwzyopnmgeuhxjbi,numero: 2; street: kczagihmnd; city: dfuvma; postal_code: 84694,+8472039030; +2486319789,blhyja; jmyao
6ab3494b-2e2d-4ae0-9b17-100d20561e4d,dnzpiavf,Female,1969-07-31,Dermatology,jzfya@domain.com,fjkzuiqvotnlhceysbpw,numero: 3; street: rieptjuvxb; city: vihzmq; postal_code: 80229,+3027009301; +7780967887,gfopts; kdbts
d567d8c1-3904-4880-9818-8e2a2bbc93b5,axscpbyz,Male,1966-01-12,Cardiology,qsfve@domain.com,gosztnpmjkberclhuvyd,numero: 59; street: vqcgozradx; city: notglv; postal_code: 68593,+8374749283; +9159698654,wdfhco; sehcm
e96f695b-759d-436b-979d-03a937bb4fe4,abupiklq,Male,1990-07-12,Orthopedics,gdyeh@domain.com,qvknplfcewuzjixrdatg,numero: 54; street: pxkzomdjwg; city: hvjkpd; postal_code: 97213,+9109350397; +1233571486,cuwvmo; fwukm
459f9b06-61e8-4019-a752-c4ae23bc8a98,tydsvaiw,Male,1985-10-08,Cardiology,elxto@domain.com,hzlxdbcfypqnatjogwki,numero: 10; street: jxdconhfbw; city: ryqpsw; postal_code: 33045,+5521810041; +3746582124,vbnsdl; wdtpv
7aa87f60-f876-4dde-91bd-c627f0dd3847,tqjvnsdf,Female,1962-09-07,Orthopedics,phidq@domain.com,zgnbwpfhdjmsvcikreuo,numero: 86; street: rzlufbwixo; city: mjxcku; postal_code: 21859,+9023744540; +1639379440,wtkhyr; hatvp
4b395867-6583-474d-8293-ee052996de81,jkbftxvm,Female,1961-11-21,Pediatrics,jeahz@domain.com,zhysntdavrglwbqcekif,numero: 96; street: noeymkfbqs; city: btlosr; postal_code: 10830,+8007661362; +5839953648,sfvqwo; riqbz
8c1e0fb4-88a0-460c-aa73-436fa575230c,wlnptzgj,Female,1981-10-19,Neurology,putqo@domain.com,sxlvbhfaugmdikqyojzr,numero: 18; street: zcbkmsjqwu; city: wusmez; postal_code: 36168,+6735389313; +3923255344,ldmiyo; ifqgk
9170af00-b048-4a2e-87ae-968b62b6d33f,pcmtdwzk,Male,1960-12-10,Neurology,kmjnh@domain.com,pforybawcetgklhqxdiu,numero: 39; street: uwsbglrpeq; city: xplrms; postal_code: 43859,+1915426664; +6030737203,gkbjrm; hwdjf
b2087069-81e8-4a50-b861-14e6a7c034a4,vukjltid,Male,1963-08-06,Neurology,cskrn@domain.com,tupmebzvwhsxajignfyr,numero: 68; street: ufhmtwnykv; city: ywsghf; postal_code: 77089,+8273981566; +3422659982,dmjrht; clxto
1b839dad-f98a-40fa-8b03-ff4ba16f5bc0,teicwnak,Female,1965-04-03,Cardiology,lgyhm@domain.com,bhkepzvdjwcfnaxytlou,numero: 42; street: smlunfodek; city: lejoqk; postal_code: 19002,+1203632119; +9922948620,covqxu; kfuda
b93c58fe-8cbc-4f2c-ba0b-e6f19cb605e2,nbhlpfxm,Female,1971-03-18,Cardiology,choiv@domain.com,pykvxwqridoetbajczfg,numero: 13; street: kzyacfelqw; city: uezbcv; postal_code: 45258,+5662556619; +1063044044,xnuzdh; jnley
1e06cce9-1fb6-4485-b1da-08e4841d3060,mnuspwfh,Female,1980-08-01,Neurology,fxdpu@domain.com,fjksqohxmbrclnayvpuw,numero: 86; street: fthczmjrpw; city: enscjo; postal_code: 17614,+7543631486; +6508697672,buepjt; lbxzs
18f99b3d-19e5-40f4-823a-193369964eb4,ikbpnfsx,Male,1987-06-27,Pediatrics,cybei@domain.com,gaqyxjfcwlzkudopemts,numero: 25; street: armeydqtjf; city: ycvtfe; postal_code: 33477,+4263436666; +8386044442,taloje; iocew
b76a08ad-b97e-466c-b965-66b6c5af7f4c,wqyajndu,Male,1985-09-14,Cardiology,vynaj@domain.com,wdijhuagblrpzqmfkscx,numero: 52; street: cgzqotpihd; city: xacfdy; postal_code: 38790,+4714565597; +9492652657,lvxnze; acrvh
f8f3674e-9be8-4a07-a0ce-3e3dd92e7d0d,owgiftye,Female,1968-05-30,Cardiology,coque@domain.com,ptfbqzrghunlkcwevdxj,numero: 50; street: dlaswotyvf; city: ynzrie; postal_code: 16956,+6007925639; +4755389181,clagks; zcytr
bac429ac-e238-4860-8d33-e4d1dc525fb2,xfizjtoa,Female,1978-09-17,Cardiology,kueia@domain.com,xjvwfcluprkqabmteyog,numero: 4; street: krudmpetgv; city: kqurgs; postal_code: 76210,+4668948597; +8941060928,jndqzf; resju
f8838394-11ea-4c66-9023-5a935ef16785,ewqyunhr,Female,1994-10-01,Cardiology,fvzae@domain.com,equszomkixcvpanhjtgb,numero: 3; street: lxneofgqck; city: hqjtnv; postal_code: 92433,+6554756575; +8753953105,bhiwcm; tihqd
848a31ed-11bd-49b6-a329-f4fb356a331b,aveymnqo,Female,1963-07-13,Neurology,dwvgt@domain.com,oebnlziwkpmqghdafutx,numero: 89; street: lcpunoarie; city: xlqmis; postal_code: 23194,+3709987924; +9388536938,pgvuhb; jhpcz
19cf0207-35b0-40c2-9d72-8efc344e39df,ovidwsbl,Female,1968-08-13,Dermatology,urjkv@domain.com,cnhasxljktqpfdevrymg,numero: 5; street: jblvnwzhst; city: ywxhrv; postal_code: 30946,+9863506369; +4422384878,flqwxa; swhvr
d4600cc1-51fb-40f8-bac4-ac191e0d0c3e,fxpmibeu,Female,1984-05-20,Orthopedics,cyued@domain.com,kveowlsciufadyrtmbgq,numero: 2; street: szielmponr; city: yqihjb; postal_code: 63028,+7146003392; +3618710751,gkhdyi; lcxep
82078bf4-76b1-43fd-b6de-2985069384ec,iqdawnvh,Female,1987-09-12,Pediatrics,mqxtl@domain.com,atoluczkinsdgfxjrymp,numero: 82; street: oltcngryha; city: fcgorn; postal_code: 86290,+8797805423; +6305968699,fbiupq; fndjh
fbf41337-a23d-4534-8a93-f1fbb7073d92,kxrsuqem,Male,1964-09-15,Orthopedics,nryfa@domain.com,wdrmgqxtusoyznacehvf,numero: 30; street: zaincrhxwu; city: fvwjla; postal_code: 31293,+8342669521; +6662346912,aidjhy; yuvsw
892be0b7-5cfa-4c4d-add9-8dc61172af84,krcxlihz,Female,1982-01-28,Pediatrics,njiod@domain.com,scmlfkrhnwvtgjqbaioe,numero: 40; street: gpufmelyth; city: tuprqv; postal_code: 86628,+3330196752; +7880889229,gtzjai; nyalj
c98fca3c-e604-49c4-b7ff-5218ced1eb75,thypkjni,Female,1984-12-01,Pediatrics,xndmj@domain.com,pgdnojlkbuqeawxshvcm,numero: 3; street: cvkqdzwumj; city: ishxku; postal_code: 51333,+3283201805; +4931914735,ofqjgc; cnylz
bb56bd30-8816-4b4c-b0be-a9b79feb4416,mjapwfzg,Female,1969-08-03,Cardiology,rncfj@domain.com,wmyjtvrkpdalesquxino,numero: 26; street: ogjhbmpqct; city: lmoyvd; postal_code: 47498,+8050634834; +7895302257,raxncm; bdjra
2984ee9a-da56-4cc4-8363-87a68b1087f5,cpvkandy,Male,1979-12-10,Cardiology,mfsiq@domain.com,xytwpgjnauksdicoflqz,numero: 4; street: kzhwbjpfsd; city: siazxb; postal_code: 34592,+3824500801; +7988210772,yjwefz; afbpo
cebe0c0e-ae69-4136-9f56-b40eade252b1,zpqwamix,Female,1990-10-19,Neurology,lzhpg@domain.com,lcbxqpngeoskjmdaiuvf,numero: 81; street: zagwqjucoe; city: syjmox; postal_code: 83254,+4466808288; +3435197576,zuasgy; qowfi
340b2171-9443-435a-8ce1-ba02533b78d0,orgykstp,Male,1968-06-30,Pediatrics,nqkxo@domain.com,axpbmtlvifrndwyshzgo,numero: 26; street: sqwdbmyicu; city: yduqrw; postal_code: 31788,+9359827745; +1245847475,dhyxtj; ehrxp
3aff6311-9f54-4530-8087-1315916be791,jowtqxgk,Male,1986-01-16,Neurology,wight@domain.com,sblmqyvuzdgxpojkenhc,numero: 88; street: hwaosyfkie; city: ascbdz; postal_code: 78956,+7242426397; +7017040167,zcgvxb; evzrk
8789d8ad-e8f5-4064-aba9-31d7c2964757,hmxqyift,Male,1993-02-11,Pediatrics,pzlof@domain.com,qhrveswolmndjizkapby,numero: 45; street: frxygkespj; city: haxlti; postal_code: 59196,+1157029719; +3466605177,uafjos; utcdb
5bcd3335-cf22-4cb3-8b30-293c483796a5,ytcoxepk,Male,1987-04-25,Orthopedics,carqk@domain.com,ofiycwqhrgpaxzknmbel,numero: 95; street: hcutgfzpob; city: pogyqw; postal_code: 44543,+6223474924; +6406206403,hbiawk; tkxrp
339278cc-616e-44f3-801a-ee42e75cae7b,lxpgjdbs,Male,1993-09-29,Neurology,ordbh@domain.com,phyxewtfkqjuavdlgzrn,numero: 59; street: gxoncewslk; city: csjfkg; postal_code: 61489,+6681986631; +7901286909,vngkcy; rqsvx
dbd1cccc-ff3e-43b2-a3d7-0457b6e47bd2,ndpuketw,Female,1976-09-12,Orthopedics,alytc@domain.com,utnfdmsvojqclyakgxph,numero: 10; street: rfizdcxbgo; city: ohujaz; postal_code: 24515,+1000133681; +1755392943,ykebiu; jbkza
99c74163-3153-4581-98db-db6e80735a88,dtrjuksw,Female,1972-06-29,Orthopedics,pkczn@domain.com,gxhyktvqanpzfuljedbi,numero: 86; street: bjnskrovhm; city: wtdoqv; postal_code: 22392,+1797514675; +2597723132,cubaky; gqmty
0baea09d-df3e-48d5-812b-ff7d15e1097d,wetrvsfn,Female,1973-10-17,Dermatology,duskp@domain.com,vzhltrismogycekdaxwn,numero: 46; street: tduqxrjhfz; city: cdeinw; postal_code: 85531,+1952562022; +4129667957,jksndy; ykilz
87f8c83e-df72-47b1-a704-be4637fd62df,zmawodij,Male,1977-07-27,Pediatrics,ynsou@domain.com,kfxbmjqrsptehoylzdwu,numero: 81; street: pdayothqiu; city: dqxecu; postal_code: 76965,+3331251478; +5184766200,ysionx; ibgfo
1ee2ef7a-2c7e-4def-9678-7b5f30d970f8,eznimwhs,Female,1981-12-08,Pediatrics,fxjvt@domain.com,obupengiwfykxrljmads,numero: 77; street: tdhpkzmbcf; city: ntrphy; postal_code: 35535,+4041278266; +4369240582,clswfz; demtq
c4f6b354-275e-4506-8e4e-11961e4c0ff4,skgitefd,Female,1978-05-12,Dermatology,laizb@domain.com,ioefsprwljmzukdycbhq,numero: 30; street: bprltiujdk; city: jhmksu; postal_code: 60936,+9930268259; +5159054369,xshlmi; zbtqc
88acffa1-f45d-4757-9563-70dd4caab61f,imhnvejb,Female,1972-10-23,Pediatrics,phnge@domain.com,ranbphvmqsucyxelkjtz,numero: 20; street: dwlbtjrhnu; city: ferpqk; postal_code: 20393,+3140542134; +8553087152,rstnho; xqzjl
de785a50-b4ee-44ae-8b7b-c3001cb79b65,fqgtjdeo,Male,1979-08-24,Orthopedics,udjev@domain.com,wqxouldvitjknzhprybs,numero: 55; street: ejlwryvoug; city: oaecmd; postal_code: 71837,+3561360695; +6752828380,hrsuqz; uihpa
fc51e4e4-416b-457f-90a1-d8908e7425b7,vuhdkmrj,Male,1991-06-21,Orthopedics,gxlrb@domain.com,iyburhjfecglkoxnszap,numero: 20; street: gbvztfwckj; city: rjsmtb; postal_code: 79295,+3659943628; +7264929082,gfwxyi; cprwg
d11ef8a8-cde2-4b55-ae01-be16f692c316,xfokcyiz,Male,1986-11-24,Neurology,ghsxl@domain.com,rfuxhasiwkptodjmqbcz,numero: 92; street: zqlydkejfp; city: jnspft; postal_code: 93782,+8800683129; +8784711125,bicxdy; jhypv
61e3d8f3-4db0-4af2-90ab-70e62dcbf139,leojupbt,Male,1981-03-14,Pediatrics,qekpb@domain.com,mxzcntbhgswypdkjufqv,numero: 85; street: gowsvxbtpi; city: wbeodi; postal_code: 70260,+3207671353; +2207954494,zejkwp; evyxd
8c42239c-ef6d-4ab2-b6ec-6d5cb42ac9a0,gzitrkbe,Male,1992-08-01,Pediatrics,yslur@domain.com,kqfpybogtrnzwcxmjuad,numero: 41; street: lhjvmasiwe; city: hpxsgk; postal_code: 84509,+9733501650; +7940297536,vfkwpx; ktoib
a92f9ae0-54d0-43be-9612-70beaad00690,hijmgoul,Male,1992-02-15,Pediatrics,vlghj@domain.com,lsvfubwpntqixoemrgzk,numero: 59; street: rnmbjivzqa; city: drwimb; postal_code: 58578,+6050917074; +3834220987,vyxtdc; cpdjl
91c290e8-20c2-4d04-a55b-3bb23c614299,dmsorwuq,Female,1994-10-02,Neurology,zsaie@domain.com,urjybmigeozfchvnpskq,numero: 35; street: tuzvcwdkhr; city: rhtydi; postal_code: 21894,+1160268783; +6791689135,isapxu; xmhuj
f897390e-48c8-415b-a323-c98d0ad91db9,bzegjkoa,Female,1963-03-04,Dermatology,mbpih@domain.com,opjmagfnlqscudbhtyre,numero: 52; street: bxtwrnlvgy; city: aveutz; postal_code: 31331,+3130455375; +5413014290,qltvsj; fgoud
16b25c0b-3b07-4b0f-bf94-b17e9ae937ad,bdejvgam,Female,1993-08-31,Neurology,ptbrl@domain.com,fptracylmekxbngiqjvh,numero: 98; street: eacxosrgvp; city: syknlj; postal_code: 58323,+3218280335; +5241247819,mgisdj; mavix
683fbfbe-0927-49ae-b1bc-a2f6005f2222,akijprhv,Male,1990-11-02,Dermatology,gufpo@domain.com,dgblafpwesxyvcrhotzk,numero: 33; street: fgmraskclq; city: ewtlrx; postal_code: 36536,+4736558649; +7068698721,akcosm; xkfdo
f5e48d90-d1f0-4981-927b-6d52f4ebecac,tpflbsny,Female,1985-08-21,Cardiology,qkbts@domain.com,frainesdmlkzqvhbxcjy,numero: 62; street: ylkpigqdjz; city: qkboep; postal_code: 39662,+6921050941; +7941369750,cbpkwo; sgxkr
057c819c-cb7a-48fe-b39e-0e6b5b4ac848,inydwlpo,Male,1987-05-09,Cardiology,hczeg@domain.com,bgshazjiqdnmpxkfltyv,numero: 66; street: yawxfrngdp; city: rvksal; postal_code: 23914,+2292411120; +2763140079,ekynzv; uzdbn
0f6113e8-35d6-4885-99fa-e9d5ecece561,zrhlntfy,Male,1979-04-06,Neurology,bsocu@domain.com,cfethjqgzsormiyanlwu,numero: 87; street: lcgbyvhtek; city: zdoumb; postal_code: 79273,+3684474754; +9945153062,ctjrvy; xqncd
3bc65bc2-587b-414e-ba56-cc80d00c953e,bdarfwhz,Female,1978-05-22,Cardiology,wmchk@domain.com,leqfgzbskavjmwyudhot,numero: 15; street: lcubtznymd; city: miwgxf; postal_code: 42215,+9744265771; +1991413198,fiodsb; mbdfp
f6b8df98-e455-4316-b2d9-a57f9a86fc32,acgkvrfs,Male,1961-05-07,Orthopedics,cyrvu@domain.com,yewvujxihnfzqlkrtbcg,numero: 78; street: bvnhiqpaej; city: zluyfa; postal_code: 68034,+1225514744; +5563384568,egsond; kixap
63bbfaa5-8648-4bf3-857a-b5be67304681,wthlsfue,Male,1990-03-26,Cardiology,qjrik@domain.com,cubdazgtpkxmvnwlqroe,numero: 33; street: tkefsbhrgw; city: rngwcp; postal_code: 91180,+5957954008; +7002964573,fnbhix; fqmev
859d7a72-60e5-4fb4-aa9e-a878182859f8,zlivkoqg,Female,1969-07-31,Pediatrics,dxqcs@domain.com,cgiutjndyweaqhlobpkz,numero: 64; street: fomhuliyjt; city: bkhtfa; postal_code: 95629,+8006278137; +6782304069,nbsehz; wsmuk
c7c63ed4-cd00-42b6-8e98-6764022c2298,mtyulwns,Female,1968-03-08,Dermatology,vtbwg@domain.com,mulrzcbtjkpwyqafsnoi,numero: 97; street: htgcunyfsr; city: gkabwy; postal_code: 14198,+7250956365; +4760875148,ecdtnv; yrklm
19d192e9-b585-4467-a68c-bea0e6bb76cf,gryxmihk,Male,1981-11-22,Neurology,julgv@domain.com,sifbjpaxdrtkcgzouqny,numero: 38; street: etvgwbfmch; city: qysnai; postal_code: 29599,+1003423627; +1750325784,ybxthf; oklvy
603acf00-b3ab-4c4b-8f34-33cabb600f38,tpsxelad,Male,1990-05-27,Orthopedics,icaet@domain.com,fotimqjhsdwkeczvalyg,numero: 39; street: ystagchijd; city: qmbtcf; postal_code: 74013,+4406599458; +6262306402,ialzxk; tabdo
731795d0-148e-4195-9ad0-0e02f38cac87,gtvslhnu,Male,1983-12-17,Cardiology,dsbcn@domain.com,sexarzqikjndmvfcywhp,numero: 26; street: aopdgyvxtb; city: ichsvz; postal_code: 29628,+5257532207; +2627030515,xtzowj; tplam
bbf6a178-65ac-41b6-a71a-9b0eda69adb1,xqlowcvi,Male,1983-03-01,Orthopedics,ptncx@domain.com,pukhyolcfagmsebvzxdt,numero: 48; street: lfhsprivkj; city: xuondg; postal_code: 43998,+4819547631; +4044101351,zlieyg; kcjfp
8e2faf33-6f71-467d-99f1-ac18356d5eb9,gocbzkpv,Male,1986-06-27,Dermatology,clrvx@domain.com,pdehgywzqnmbiusrovat,numero: 19; street: zdakysgjxi; city: cbrzqd; postal_code: 29104,+3185638811; +5512114318,nhxouq; wjbpd
dd543ba2-c7d7-425e-8b03-0483bae9edd4,iobjxemq,Male,1964-04-05,Cardiology,hezgf@domain.com,wurntovjplyfimzqkbhg,numero: 19; street: gqmhcbpsef; city: ngaxio; postal_code: 48029,+1731087198; +4466626300,xlhbud; mbypw
761d3523-f651-47aa-903f-99803c3ba646,mefgtwcv,Female,1988-01-09,Orthopedics,extzs@domain.com,xekgsptncqubiljryvzh,numero: 30; street: vnzygbukoh; city: mxzpec; postal_code: 97751,+7798931687; +4164761243,xmjsci; bcuir
c0006ad9-874f-4ee8-81fd-9cc691d7d69b,sbiahglf,Male,1965-04-05,Pediatrics,soyej@domain.com,cjkuyisnmqroxvalwhbz,numero: 74; street: zykjoefqwx; city: ormnsa; postal_code: 89206,+2566965234; +2715936533,oyqaxg; ohjup
eeed5588-6352-488f-83d0-7964dd2fbdc8,wumvpijc,Male,1983-01-26,Orthopedics,ecfjs@domain.com,bydjtxwgnviomlufrqsp,numero: 87; street: cjtrfdsgim; city: dtpexw; postal_code: 36044,+2317241541; +3766968441,vbceyt; rbufs
589b6a0e-f681-4e65-81f5-dbca029ede45,qjotvlwa,Female,1976-08-11,Cardiology,wkofq@domain.com,zcepfdulymiswjoabrxk,numero: 55; street: ezqisnumvh; city: sgqvyz; postal_code: 70562,+5108826067; +8621700309,eazumv; qvcwd
a2d92c37-4d18-43ee-993a-17fd495f9ed7,ehudmwgy,Female,1992-12-10,Neurology,gwmcl@domain.com,ifzdxygstnkavhmljqbu,numero: 51; street: upwbkqayvm; city: acvpzj; postal_code: 43907,+4483657330; +8994444629,dlzxor; puaey
6914e022-898f-48b9-a844-b373161c9302,nmubsile,Male,1984-11-17,Pediatrics,zkxny@domain.com,zwnpxurhjbqdmvycgoek,numero: 79; street: mywlsngfrk; city: ehcdlz; postal_code: 78150,+3989008258; +8684527491,cglort; bzjps
51935d42-4f68-4c75-a3a3-227cb1da84bd,zvyhfnlw,Female,1974-03-19,Neurology,eobjh@domain.com,tmzfksujvqaxnhrbcyei,numero: 50; street: avilhuefmw; city: csufwa; postal_code: 74414,+4730693608; +8953335373,pqjyfx; btiza
5cf1b71a-c178-47b2-9042-b6d165dce669,ovrclpfg,Male,1982-07-19,Orthopedics,hyfam@domain.com,gfhczkjxpqrwmiuablvs,numero: 49; street: ciubzeghjk; city: kwazym; postal_code: 48013,+8669743902; +8306423752,slmegn; nwvex
97348973-e87a-4456-9a54-c3736756e62f,afrysimk,Male,1988-02-23,Orthopedics,hqpxt@domain.com,wifhmnqjxrolpkuyzgvt,numero: 78; street: ipmwrzbgon; city: pnfkou; postal_code: 45048,+1503326283; +6042951555,zahpgs; qopsa
37b26475-512d-460b-a8a7-b91bd1198107,pyoeigzh,Male,1967-07-03,Dermatology,dywbz@domain.com,zcnjifutebdywkghqmap,numero: 21; street: nhdrxjtuwl; city: yfmswp; postal_code: 68826,+1332259382; +9159380257,hcplmt; deasr
ea5be60e-d430-4cf1-a642-b6528c46488b,gqwyhfkb,Male,1975-10-19,Orthopedics,qwuhs@domain.com,parukvmizjhbelgnxwoq,numero: 75; street: zwrstyoagl; city: kpfsav; postal_code: 78606,+5904192076; +5351398342,kelrzw; duqpm
