id,nom,sexe,date_naissance,specialite,email,cv,adresse,list_telephones,list_prenoms
a29d7fa3-1e10-48ac-95c5-d4cff58b4640,ltnjcxfe,Male,1973-06-05,Dermatology,rsunz@domain.com,qrjnxzghdspoatfvibyu,numero: 29; street: hadefjksiq; city: jsdpox; postal_code: 97848,+9611841779; +4711374110,avxwku; dvpan
ef36fe64-f320-40c7-b259-bdd62016ce0f,boyihklp,Female,1990-03-25,Orthopedics,chgvw@domain.com,uyawxlvmfibdotqenrkj,numero: 23; street: bcaeirqyod; city: moqczh; postal_code: 60287,+2191485275; +8870648599,laxidm; anhyj
2f542b35-1db3-4d6f-8bf4-410cbf58e160,auktfcnm,Female,1963-09-04,Dermatology,epnsv@domain.com,ifeqlncjsrmhtakoyuxv,numero: 49; street: wyahdilnxp; city: bfnrvi; postal_code: 98969,+6917012954; +8333249993,rjduxi; szgrc
dc58a08b-03de-4614-8d7d-013d130362bb,ncytjhfg,Male,1981-02-14,Orthopedics,lrepb@domain.com,bingrpsoxcatmfhdwklj,numero: 6; street: ixzmqjlkwt; city: ylshvr; postal_code: 28502,+2816238078; +5035072758,oubnym; yrxki
4f17e60e-0005-4cab-8210-affeed8c554c,hpxtvmjk,Female,1991-03-03,Orthopedics,pahct@domain.com,kqftcszohmnwperjbiad,numero: 39; street: cmbaxnvuqz; city: sbujoy; postal_code: 25705,+6066567194; +8556088245,mwheji; touxg
b32c2363-d8a6-4323-8eaf-e3db4ceefe3c,xthquabr,Female,1962-11-15,Pediatrics,wlknv@domain.com,regpacyvxtwznhkislmo,numero: 92; street: iolfsmqhxd; city: qnspre; postal_code: 84160,+9878141042; +8512297352,lohvbn; ovzam
c3d1a691-213f-455e-90c2-86ea69bc5376,bscpntvl,Female,1975-04-02,Orthopedics,rvpcq@domain.com,oludxpcvkzrysbnjitag,numero: 80; street: qutoznjlev; city: futbxr; postal_code: 84610,+9649000061; +7186924939,uxhkog; ljdoi
6d78261b-bbb4-4a77-b14c-a61a9576be45,ycfrgsmh,Male,1971-12-24,Dermatology,yixqc@domain.com,hfbgpuriwdtkezoyjaxc,numero: 7; street: mfahenrbuv; city: txjwcy; postal_code: 67949,+8138210759; +2645801857,tylqev; ogews
859531b1-76d2-4e1e-b18f-c8b6eb9d8fc0,egvwtkji,Female,1977-02-21,Pediatrics,qveba@domain.com,ztfhwqvodklabeumnpjy,numero: 15; street: kvijawqcxe; city: uwgayd; postal_code: 18477,+6927887690; +6006069718,ytmnij; pycsd
fe48e137-6cfd-413c-bd22-d53c40819f95,agtuhjpc,Female,1993-06-10,Neurology,cpyei@domain.com,tawmueqifjpcorxdsbhl,numero: 26; street: uiydvkgflj; city: hqvtaf; postal_code: 10521,+9112312118; +6328991548,spnjur; ahoyg
acd70ac1-04d4-414d-850f-7265dc3f32c2,opikfhle,Male,1979-07-19,Orthopedics,ezwmx@domain.com,itgwqshvacbuyzfjrmod,numero: 88; street: udvgyizcqw; city: qhcevl; postal_code: 17390,+1287102997; +1851492940,prjedf; axprg
4edddeaa-698f-47f9-86c3-ed618c3eceb0,vkgofdcw,Female,1994-07-24,Cardiology,kjfpa@domain.com,ltzjqwgahiuymnfxvesd,numero: 97; street: tvzldypubi; city: mdgkeq; postal_code: 99153,+7678338426; +3979997437,nzujtg; jayis
d9e99007-f89a-40d8-a4f6-bbd48460bfa0,kcrsvxmo,Female,1993-08-09,Cardiology,yhgdj@domain.com,fqylcgxhsntawkeuribv,numero: 10; street: xjasepdhmb; city: eivjmf; postal_code: 71119,+4508093755; +6588856069,dalijp; tpedk
1b275c4c-4ba6-4daf-a287-816eef481911,dmepiway,Female,1995-11-01,Cardiology,yixdp@domain.com,sfmbadyctrwxiozhejnk,numero: 22; street: lxnmcrojky; city: cgsurz; postal_code: 91226,+1100415521; +2287921818,xfzuqb; mwshv
0a357d18-0f89-4e11-a578-3e71ca8170f3,ovtymwkx,Female,1994-01-24,Cardiology,waoth@domain.com,ebtivkjsqyzhdfnpmwrx,numero: 36; street: gxumwelhzv; city: ndseat; postal_code: 83261,+8232970290; +6441619510,fvircg; gipoy
a5d74d0c-f51a-4e01-80bd-b5d0cd8bac48,zmpcasnb,Female,1991-01-17,Cardiology,fmosg@domain.com,katshcbdijfnevurgqzx,numero: 12; street: jzyxhqrasg; city: nkpweo; postal_code: 63149,+9240905136; +3207591545,juzodt; rmnuh
883e8b33-3eda-43bd-8602-c62fbb7f5b94,phaifwns,Male,1980-08-24,Cardiology,ypizb@domain.com,dumbrifglpsaqjckzxht,numero: 35; street: ghwlxeiovr; city: tjyghm; postal_code: 92913,+5510263627; +4051066466,suhvyc; evxmg
10e5c7c3-6a55-4f7c-a429-337986c2e10f,vxsphtfd,Male,1977-03-28,Dermatology,aipez@domain.com,nlukpytqjgszirdocvem,numero: 56; street: xkyjhznrmb; city: nvgxiq; postal_code: 63862,+8709197154; +8008582332,ajqdxs; sdrfq
e8695da8-b481-4321-9381-8f04c72375b6,dsjicfnq,Male,1986-06-03,Neurology,wqhza@domain.com,iugeqznalcfrsjxoytkb,numero: 40; street: wmhtckfeid; city: lwijnk; postal_code: 60933,+7713672487; +7031105778,jacbnf; wupey
dd59d3a2-236f-4998-87b5-c3faa269009c,ajoupztk,Male,1992-05-29,Orthopedics,uozfx@domain.com,muxlohbkndgtecrsfipz,numero: 11; street: flmjnpbaes; city: ykdieq; postal_code: 88713,+5398129078; +6911372836,qfwneb; qriov
e59faa48-8240-4b37-9c49-5b8ac8159395,kgtijeou,Male,1966-11-20,Orthopedics,wznlt@domain.com,nabhwfqtsyopclezvgud,numero: 17; street: hycmrvxzso; city: ukbvsp; postal_code: 46461,+2562715841; +1003188351,pqhuvs; paxud
6b4111f3-381d-44a9-99b0-87f1862f8f59,cwtlzmib,Male,1983-08-20,Neurology,tlvdo@domain.com,pgeqzwkihlsbumnytrcx,numero: 66; street: vjqdnkyscl; city: czxpro; postal_code: 14076,+6241726366; +1956784395,srvlkw; ibzok
588fd301-618b-46c9-af11-7f5286402e96,xjreivao,Male,1967-12-08,Dermatology,puinh@domain.com,dyqzbgpijtxnskecmloa,numero: 79; street: qlgorctunf; city: turakm; postal_code: 77555,+7627986014; +2766109716,dryiam; getdo
2b38c39b-c3e9-41d7-84db-1062337c74a5,endisfby,Female,1973-10-25,Pediatrics,wtifm@domain.com,ryhkcztuvadomsjfplnw,numero: 28; street: yjaplfmrce; city: nsyrog; postal_code: 51813,+3747441058; +3605773233,yimtvb; zkxwb
426700d9-8794-4a76-8d9b-2d22d6b270d2,ovmxjfsi,Male,1974-02-11,Pediatrics,tpwmu@domain.com,smjoxaepulkvyzbqdnif,numero: 84; street: kugxoqcpmd; city: zrwgay; postal_code: 64047,+5718053516; +3780646921,walfri; ebozl
aedfbabb-f325-4e5c-a228-59fb4392ce59,alksubpt,Male,1961-11-29,Orthopedics,rwden@domain.com,mjwxpnorezclqihakvub,numero: 51; street: xvfznqboyi; city: vrgduz; postal_code: 29092,+2567000396; +7926973714,anehix; xibec
85f1f06b-ffb1-4aa5-a984-15ee6e7c57d9,fdkomhip,Male,1971-04-03,Pediatrics,dwxrv@domain.com,oiptwuxbslczqfradyjm,numero: 9; street: fnhyrbsieg; city: ursphb; postal_code: 79537,+9242921447; +9221798660,ahwyfx; rxzus
223e518b-52d8-46bd-bf60-e0f37eaad880,jlympiew,Male,1981-12-10,Neurology,trkcx@domain.com,tzrbmgqewcinyfsvupko,numero: 13; street: gbypevmtsf; city: huecql; postal_code: 76144,+4308709917; +3895257527,qlstpf; kdqvj
0f1b3df9-15e7-40d0-bc43-c68180f1af35,otaigkwx,Female,1962-11-03,Dermatology,dmhbg@domain.com,vgwldezcqnpaijbyumsk,numero: 91; street: opsxwgyntf; city: zymenx; postal_code: 31131,+2210091453; +2426375521,qomisj; uceha
6a238c03-40d1-4d4a-acd3-2d1dfaabac40,pgfsdtiq,Female,1967-08-10,Neurology,jyswk@domain.com,tkumgyhaneifzsloqjwb,numero: 10; street: ugiqljrcmz; city: yrvmko; postal_code: 34803,+1846159292; +9312071239,wobajf; nvbyp
5611beeb-126d-47c5-a373-d363b4ae858e,nqstlbxr,Female,1968-05-03,Orthopedics,phefn@domain.com,ocedkubxagqvzhwsrtip,numero: 76; street: kysxjhmduc; city: vkjtcw; postal_code: 88243,+3743952038; +5958752764,dhjsyf; atqlg
8959b7ea-f222-495b-8375-9b5c9b00195b,bfwayzjq,Male,1962-12-24,Orthopedics,ldysi@domain.com,ynxlhtbcodsvmjzwuirk,numero: 82; street: ohpsrnctxf; city: xetlof; postal_code: 96324,+2630216065; +3011690283,asuxed; gutbi
64ccc83c-13c8-4a36-8693-bcb0cebabc92,kqxdjwzf,Female,1963-06-19,Pediatrics,siodh@domain.com,hwbtvoxlqnfsarzkpucm,numero: 66; street: slhkxagoup; city: csnixm; postal_code: 57170,+1663516775; +4550829982,yibnvz; awnpf
f406cd7d-0cf7-4d35-804a-0574c86d6121,cxspevgh,Female,1985-09-29,Neurology,hntwi@domain.com,qoarnzleyxfdpcsijtvm,numero: 86; street: dzapgtuwmj; city: chknej; postal_code: 53616,+3652227853; +4231371755,dxjksq; bylhn
ee02af5a-c23a-4ed6-9396-955cd2da3584,qoybhvgz,Female,1981-01-16,Neurology,bedwx@domain.com,hanezlgojdfcwqptibvy,numero: 62; street: lgfwthdcyb; city: apmrny; postal_code: 38061,+9786808743; +7745887425,vuzlae; avgld
a36dfdf6-f0c7-4b8b-8313-8184f10b6340,dcuzhmtl,Male,1980-05-01,Dermatology,ybhwp@domain.com,ftgmwkyxvrpbcselzuqi,numero: 64; street: ufaqrzhjix; city: jdairl; postal_code: 80000,+6521091987; +7775670176,tfevpi; dcubr
92d95d6e-d848-4f4b-9d7e-95556444a3c2,jelmwhfv,Female,1971-06-16,Neurology,noxpc@domain.com,rjbnclpzmdaxwtigfsqk,numero: 61; street: jsyrlmdgxe; city: tijnru; postal_code: 33429,+5140458796; +4590443105,odxhzs; iaoys
817f984c-d583-4a1c-9a91-e5e4b6a65b5d,vkwifeaq,Male,1984-08-17,Orthopedics,pknhi@domain.com,ekchxrfwaiypslvzjbgd,numero: 23; street: gmtriscdpx; city: kqmept; postal_code: 59566,+8056300024; +1373507415,nbkeds; jdshn
8b16d47e-fdd8-4a03-8271-90f60926d96b,pahriqzl,Female,1975-12-11,Orthopedics,lnfpg@domain.com,ypevshwikumagdnbcfjq,numero: 12; street: qmzjlcryad; city: kwytge; postal_code: 48029,+9723100880; +2632265921,vxwbhd; rtswc
6f46fed1-59a6-4746-bb1b-cbaa84c51b6b,boiegslw,Male,1966-09-19,Cardiology,jagmc@domain.com,kvtrhopinfsaeubgdycm,numero: 80; street: uxknobzqwv; city: yhlqtd; postal_code: 52155,+4239556236; +9636403600,wjiqsb; fdorg
d0466218-6a55-4d17-881c-7cfb311e2a3d,gjmbcdwh,Male,1964-02-09,Orthopedics,squyi@domain.com,zqxyshoulecavbgrjkid,numero: 8; street: zhyjetcwga; city: mranyt; postal_code: 91742,+2887234376; +9538903412,cdoygh; cwlin
93f9eff9-a2f5-4ff3-8778-375e2ac4598c,fetydnhz,Male,1975-08-06,Orthopedics,rsvfd@domain.com,mpxvikodtbczelwqfyjh,numero: 96; street: jxrvzmkgsy; city: yexmnf; postal_code: 87523,+9065856665; +7285132828,ldbhwv; lvxob
fd4e12b2-39b4-46c8-a302-d98cd146853d,kbijnulx,Male,1995-03-14,Pediatrics,pqtcn@domain.com,yfixnlwujhdkbpemrogt,numero: 34; street: zdnhojmuic; city: drhlyc; postal_code: 43306,+9405449082; +1854306376,vcbfsd; buaow
8ab26213-db68-4da8-ad7d-1ead5e0b2b4c,ezdianjm,Male,1982-07-21,Pediatrics,vyxju@domain.com,qizkxwgvfrdcapujelos,numero: 35; street: ampjcrtwgi; city: uhnefj; postal_code: 67573,+1402544614; +9559864565,tvpoyc; orxcj
3ec24519-9bcf-4934-afcb-3bdfe7cb43b1,vbwmeniy,Male,1966-03-20,Cardiology,tlwkg@domain.com,tjwpgcmrdxohzeluvayi,numero: 24; street: rihgwbopmc; city: guntaf; postal_code: 69502,+1335631775; +6267100577,ypcjug; tlufh
c4f12a1d-d978-4f30-bd30-abcdc4f87aef,vtcyrjsb,Female,1984-09-11,Cardiology,whvca@domain.com,zleqygcijrmovawkntds,numero: 14; street: gelhzxwquj; city: kruhsw; postal_code: 42345,+2086760496; +1237509300,pbdhou; lmngu
7ad3074c-a075-44c5-a278-237c84faf289,szcfeqnu,Male,1972-05-18,Dermatology,rtjsg@domain.com,vpkomgfwzqxryndaijtb,numero: 81; street: omniapdbet; city: nglzka; postal_code: 74501,+8809620468; +9825841925,pnafgj; fdlui
9c3d8210-4446-426c-b9db-9af254ffd5e8,uhpadbev,Female,1969-06-17,Cardiology,rvbqj@domain.com,jrpsuhmaxkcinbqgztvd,numero: 90; street: lkcrnvoxqh; city: shqobx; postal_code: 21593,+6301120936; +3078016272,pvcwro; qsvhj
7a34e80a-5045-4342-9937-6fd923b58f5d,hojvnqaw,Male,1967-09-05,Cardiology,gzcul@domain.com,ikczdvlgbspxyejqfurm,numero: 82; street: zgacpvsqik; city: mozewh; postal_code: 62733,+4631831946; +8132012166,tkcyhv; wivfc
190ba550-27b2-4d1d-8968-1d122581a038,mhuwqioy,Male,1995-07-04,Pediatrics,bokvu@domain.com,liwzcqbkmvrgthepdjou,numero: 47; street: revczayumh; city: bndmyj; postal_code: 13586,+8236790230; +5447659230,jgdlyu; apynu
8b5b8849-4e20-499e-9adc-743560506b3b,bliosnth,Female,1973-04-28,Neurology,bfdwh@domain.com,msaopujnyfrcvkthgdlx,numero: 4; street: bmwzujkadq; city: endciw; postal_code: 81436,+8655339457; +3858230208,qblgfj; ocirt
bc09db8d-19ba-4ceb-8e00-6d3efffbd808,wcnaiudt,Female,1964-07-21,Cardiology,ojwgl@domain.com,pzcofkseixqbydlmtnuj,numero: 40; street: ytzogvchqj; city: hwdgti; postal_code: 85300,+7779325221; +7050632816,spnmfh; gfsjl
22d837af-272a-47d5-8029-719b4b69d4d0,bfxupqty,Male,1962-01-10,Neurology,rpdsx@domain.com,hlxyujbmeivfgzqpnors,numero: 25; street: klnbopiumh; city: qugdyn; postal_code: 83276,+9241996840; +5011908164,inyvzu; nyzcm
3862c17e-dd5c-4fcd-a581-b3ddf7a148f5,ihbplfku,Male,1986-07-24,Dermatology,edvtw@domain.com,aijtzgnklfxuhqebocvd,numero: 50; street: oerklvjpct; city: vorwgd; postal_code: 63945,+1415347368; +5345064472,kzsexm; lswqz
ac45ae8f-6480-4681-b9b2-ffca605ee28d,ywvclrae,Female,1968-07-31,Dermatology,imsxz@domain.com,wrijotdlpukzbxgfchnv,numero: 27; street: kdjxuvprch; city: hntxsg; postal_code: 21906,+7607180841; +3235496663,xawnjb; bzlpf
635bba60-090b-43bb-9ef1-e3cad2619800,szdobnfv,Male,1972-02-23,Orthopedics,srxtf@domain.com,lijguxqfvtnkswcbmoyd,numero: 83; street: shierdxjmn; city: avelhd; postal_code: 57455,+2621045354; +7725343195,bdofkn; rvfbn
b7b6a351-4e3c-47f6-8e5d-d28d4b9bf88b,xcvgetzm,Male,1995-04-25,Pediatrics,flpje@domain.com,zoctlvmsaijdekyhfgxp,numero: 79; street: xwbgadsifj; city: qowmcv; postal_code: 22970,+8167055815; +5535047802,bkqoev; vjlpr
268ef297-1d3c-4457-a09b-94115292ef20,lesukwtn,Female,1966-07-30,Dermatology,lfbqy@domain.com,yvnurslewfixzgbkmatp,numero: 78; street: cqyzjkaxvf; city: mxqygu; postal_code: 90290,+7392699700; +3818855230,svoatg; xnepw
0608bff0-cffb-46b5-aa68-03ba31c71f5c,ryetwfvb,Female,1995-09-14,Orthopedics,ohmsi@domain.com,jvlfzkywdntcmeqospxg,numero: 44; street: uorplxwfkb; city: uehvtc; postal_code: 26701,+5006344934; +8253699712,lksxyi; btsaf
dd599dad-7678-492e-8ca0-2115d3fbe037,ejfblqrz,Female,1983-02-16,Cardiology,hwgpa@domain.com,hfgakympvsznrotjiedq,numero: 85; street: pokfhmulxq; city: yclhvo; postal_code: 38668,+7710644732; +9001408353,moxphy; nlekc
14d8086d-7847-4dcc-8555-897b75c87f16,nydapvbz,Female,1974-06-27,Pediatrics,bhczl@domain.com,hmxodwnvbjyutlzgqckp,numero: 12; street: ycapgjmhzq; city: wlomqg; postal_code: 45189,+9145490246; +6159102162,zqbard; gizuj
0e78ed21-98d3-4d05-86c8-9a55be574de1,agrlymne,Male,1987-11-14,Pediatrics,shakg@domain.com,luovytizkcjnpadqmgrh,numero: 60; street: cvijfnsdpe; city: hkpsyr; postal_code: 65221,+2751111598; +5944683505,ketbop; waeti
ff43bcdb-8d66-4d95-9354-13e187a13196,xnowklur,Female,1973-09-07,Dermatology,wnchu@domain.com,swryeqbdlhvijpngzfmt,numero: 46; street: djfucqvgwi; city: jquxrw; postal_code: 49534,+7799564870; +5477819025,ymhpus; vkdzl
56e35541-75a0-4be2-ba64-f26e7031e934,jgrbtyhk,Female,1990-10-05,Neurology,haqxg@domain.com,lrxmsnfijvwpeqtacgku,numero: 46; street: enjzwkcfql; city: pjmowv; postal_code: 38551,+7846516046; +9981575438,eaohzv; tcudo
97cc7c21-4496-4795-9af8-ce0edbf88c83,moueanlv,Male,1987-10-24,Neurology,vqzsb@domain.com,pmcitsuojxgkvyrwezda,numero: 84; street: fklbduewyx; city: wogqux; postal_code: 62761,+5382029459; +7650429462,guheck; egjqf
1542f4f6-fc6a-4a7f-bca7-32bc9bd3daff,phtmisak,Male,1987-08-05,Pediatrics,fgyvm@domain.com,orxjqfepduankmbzthvi,numero: 92; street: zdcinrsaeb; city: dlgqnw; postal_code: 19731,+4981402123; +1471005136,jmcboi; adpmb
9a21567a-b7dd-4964-8196-310c8fe8d8cb,wnevksdm,Male,1960-12-15,Orthopedics,vwmlu@domain.com,kjxychgldtomqebvrfni,numero: 22; street: gbdahqrvjp; city: frmlki; postal_code: 39667,+3855658022; +8075896610,cwtqdr; sxnel
ea905db5-c85e-4159-91d3-ead0731449ef,rwnvczpg,Male,1963-01-11,Pediatrics,ehozc@domain.com,uzhmwqekvptcibdgsnax,numero: 52; street: qtksmnbeyd; city: kyuqbr; postal_code: 38780,+2403688021; +4357885537,razvqm; yaprz
b3b2dc67-c18c-4465-ac7e-da06fcf88db7,tobgjuwq,Female,1966-07-03,Orthopedics,gzjeu@domain.com,mcrtqipevdhkxjzgnoby,numero: 86; street: tzpvflwami; city: ybljox; postal_code: 95521,+6579624751; +5274844172,oiymju; nikyc
b369bf42-c747-4d77-afee-1fb45f820bf5,xteqgdza,Male,1984-08-24,Pediatrics,vqyfj@domain.com,fhroxvykupqwlidasgct,numero: 78; street: eaiopfhytr; city: ipukmd; postal_code: 21045,+3055280178; +4371933249,jehalp; emyzh
eede9a10-34a8-4492-a0d0-d97696232c63,dhyaslfj,Female,1966-06-03,Pediatrics,jeagw@domain.com,gclitnmzpuowjhxrdeqv,numero: 79; street: wftsljykoc; city: blvgde; postal_code: 71428,+3108736813; +2220364986,wbaguz; phinl
cee4f68e-9d35-403f-8c75-c176ea111dbe,snvchjep,Female,1994-12-28,Dermatology,naptg@domain.com,nzcgbqusojefmpxrwila,numero: 57; street: cpsyumazki; city: dshojn; postal_code: 41448,+3259886940; +4829708921,wzydti; avmut
1e6b863c-c86b-40ec-85db-1e752ceeb9fc,xvwsphmt,Male,1967-11-10,Pediatrics,cxpjd@domain.com,huwazqmnsekrgodlbxip,numero: 42; street: vunewrqhzs; city: sfkqyg; postal_code: 61163,+3041669985; +1913369057,lcvenz; bgyiz
0ea1b4cd-149f-4df4-865a-c1cb8cb83345,zumhoxsy,Male,1980-11-16,Pediatrics,vzntd@domain.com,ghbvjmrtkzsncepfuoaw,numero: 39; street: ozadheujfv; city: gvfezc; postal_code: 26135,+5112516393; +3807669166,hsvjea; wfiza
db12d06b-ac96-428c-b816-86ffdb680e85,hxzrtnwl,Male,1976-02-08,Cardiology,hxacp@domain.com,okvpfmnhigralczbysxq,numero: 89; street: johngtmxea; city: jylxgz; postal_code: 60956,+6556429569; +7853494347,wrdycv; ukhlb
32f5a867-c847-41d7-85aa-1b02ce4d8c72,plsywhvt,Female,1978-10-13,Dermatology,ufyvc@domain.com,zveupfyctmhadsqrxgin,numero: 74; street: umegajvnlq; city: bowkcy; postal_code: 10564,+4420801946; +4781170048,pbrhtc; scxod
b6f6cb84-5850-4f0b-98e9-6c0ee76b8bbf,ujsfgken,Female,1973-02-19,Pediatrics,axgdb@domain.com,tegslhiacyozkmjrxunv,numero: 91; street: jzxvbgpehl; city: kpnshj; postal_code: 96228,+5229139434; +1862994571,hgxmcn; ojdpi
47c23d61-c517-41fc-8b74-f32fa1aa990f,oajnewvr,Female,1988-11-27,Dermatology,ejuwy@domain.com,jkuivhtpqyagwmfxbdnl,numero: 21; street: fakzjdmxht; city: jnkghq; postal_code: 10212,+2726298800; +8011303911,wqemxt; jzrnq
12398161-52c1-48b5-acfe-69c797cdd0cc,tkwjceno,Female,1993-12-28,Pediatrics,tavyg@domain.com,vmegqyonhtkdibuxlfza,numero: 22; street: afzvdljebx; city: rkmqeg; postal_code: 47470,+9105796020; +2880802274,rvqgmf; wzvkh
12aa5f2c-e14c-4144-8539-c78c1ce24d05,wmovdeyn,Female,1975-03-15,Cardiology,anvpb@domain.com,mvnptkusqfezadgljoic,numero: 32; street: intuekgrzo; city: lsjwkc; postal_code: 26284,+3027055419; +2276483159,fgpxar; bmper
3ddb01f5-08cd-4b40-84ea-971fe5779b18,gzxfrlav,Female,1976-12-17,Cardiology,okijs@domain.com,yfmceqbnxjwkzvatrpuo,numero: 65; street: dxcufsogyz; city: ufwgkm; postal_code: 90891,+5168388109; +2184655099,yrkcou; ohnsd
7122233a-389f-4d78-a403-fb9f816ace8e,qwxtduji,Male,1969-05-29,Neurology,gijml@domain.com,jvymdnsparhoxcubelkf,numero: 16; street: ljmwxobtpc; city: hbpynr; postal_code: 84024,+6802007349; +9768933506,kgdzsi; tbrwp
dc26ab19-7d7e-4f83-8e00-b9be20ce2f0a,adskqexh,Male,1992-11-10,Orthopedics,urjsn@domain.com,hakizclbjdmxgswvtnqy,numero: 47; street: itxgpyfonw; city: pxmrwg; postal_code: 97249,+7418624161; +5969229933,jmvliz; ozrnc
305c1cf5-cb68-4b9a-b28c-12db0477e7d1,dnlszbqf,Male,1965-07-07,Orthopedics,icold@domain.com,dfkczjuthpmionxsleab,numero: 88; street: nyiuegdjfz; city: obiacd; postal_code: 83707,+4667405855; +2207023031,oplvcx; foamb
d1ceffb4-d2ab-4738-b074-8c8445ff2549,wsdnptcu,Female,1971-03-13,Neurology,fhopr@domain.com,ljewvfuocszbpxmnahqd,numero: 41; street: npjqlazxgu; city: pclnoy; postal_code: 98735,+6728499589; +9262643909,ytvsjr; xmdna
53672990-784f-4677-af5a-5b3136d3e122,xscnlhqm,Male,1984-01-13,Orthopedics,kgbwu@domain.com,ryxifjopvqhcnkadwlbg,numero: 96; street: hokecpndfs; city: lpqjwy; postal_code: 53150,+4509950854; +5429907026,gavnoq; pocwi
d6862e59-3504-42e3-91d9-91925ed13ed6,dvqawlmx,Female,1966-11-13,Orthopedics,vfxio@domain.com,svodramjfwylkuzitghn,numero: 96; street: byjohagevr; city: snvrhi; postal_code: 53506,+3641882536; +8896111008,zejofu; apwml
2c47beac-4078-4078-8f9e-b07551e03a2c,ypcxkand,Male,1988-04-03,Cardiology,hgpsc@domain.com,ovlhdeaucyjqpifrtmxs,numero: 90; street: omtukfprzc; city: bucswh; postal_code: 80899,+6855862374; +3474605665,kpdbag; aqody
925b13d5-796e-47f3-9664-87bf155d779e,oykgtwhn,Female,1979-12-02,Pediatrics,rstnb@domain.com,vaepwdqxrigoylmkcjzf,numero: 96; street: ucldmntxoa; city: pbmfwo; postal_code: 14636,+5528775983; +1398082738,hgiewl; djpbz
9ece0e90-5d65-4296-83f6-41b0c8bdc7d8,qyhnoxiv,Female,1978-01-12,Dermatology,rspxj@domain.com,wxqnpmtekabjglrsvycd,numero: 81; street: wynkldbfej; city: awfgti; postal_code: 38342,+4880736965; +6090212299,kbwiht; jmyit
fe88049b-f524-4925-82f3-8168a6992eb5,xprjhoud,Female,1992-11-19,Dermatology,mtofk@domain.com,pauleqnwzhmbkfgicdoy,numero: 64; street: zbfcgdtxsu; city: wieyso; postal_code: 42372,+7656781113; +7169708355,wvlzyb; dtbma
a3db21bd-e18b-4a6f-91cd-6cb74d0d32d2,svwhnpmu,Female,1965-01-18,Dermatology,djioz@domain.com,izglhydutwnxbqfprema,numero: 8; street: mwnaytfhqk; city: eicqoy; postal_code: 79372,+3466696149; +8841502463,uaitys; gvnco
e449fd3e-e87a-4be8-a3a6-974297649838,rwbevgpd,Female,1987-12-24,Dermatology,kfxlj@domain.com,fovkgmctwzlrdaebshnq,numero: 46; street: ogxdhqszce; city: drftom; postal_code: 53327,+3899167944; +1245007762,mkvaxs; hvqgl
045a2a23-4d16-4cc6-ad62-a2289308cb4a,jfpmnohb,Male,1961-04-07,Orthopedics,pgxaq@domain.com,gtrodbyzulifhjcamxqn,numero: 6; street: lfunxjkohs; city: omzcba; postal_code: 62356,+2736943255; +1928721506,nqzeua; hmgwv
35991dd6-4abc-446d-99c1-7d30d792b751,kcogtxds,Male,1962-06-25,Cardiology,auize@domain.com,nyvetwljihsgxpoudzkm,numero: 4; street: hnlpzickvs; city: lhkaqw; postal_code: 17296,+9243957530; +7238878640,yftveo; ncksj
6b4b113a-1dc4-438c-88d3-33ae9166d3f6,vgrinbxw,Male,1981-01-27,Pediatrics,jahnw@domain.com,lepxhjvgnutofmiarwdq,numero: 81; street: qxoupghzsm; city: ofwyrn; postal_code: 18893,+7656015717; +4865764337,qzbjsr; pcxjb
dd18f3a0-e692-469d-82e0-ed03e6816c3b,eflgiujm,Female,1970-03-11,Dermatology,ldtos@domain.com,daoplvexwjimfuyzbtqr,numero: 52; street: xronukpltd; city: wijutk; postal_code: 30271,+6331678781; +5153360074,faqwyd; vhqjd
89637cbe-c34e-4a03-82d3-4841cd66aa5e,pmdhctwo,Female,1975-01-30,Dermatology,cyalh@domain.com,cgxlysvbhnduiepwfjot,numero: 27; street: zstcfpewaj; city: vwidtb; postal_code: 25819,+9774692569; +7318135310,vrfuja; frzow
51e50c57-3c2c-47d8-8d19-f89bb011d356,qxsituao,Male,1985-06-25,Cardiology,qfvxm@domain.com,zclrbdyoqviewmsfkgnu,numero: 32; street: qbtvokmdgs; city: ukocpf; postal_code: 61198,+3044456972; +3083309510,ctoxnl; cqlya
81cbfe42-bc6c-4ee6-9151-94c882c58085,ygwijtzo,Female,1963-12-05,Cardiology,nvwrp@domain.com,njgplakxurzqmtoivcsh,numero: 16; street: jpqoxveawy; city: oqsmtc; postal_code: 33484,+5357038084; +3903334554,fkzoyv; eaofs
91ae1e9f-3459-4364-9770-a797c3e0821e,ostnbdea,Male,1984-01-16,Orthopedics,xfyci@domain.com,laxbtphckqfseomyiruv,numero: 50; street: kpzgenbqco; city: irngvp; postal_code: 38821,+6213470911; +2464046150,sikmpq; qiguk
427118dc-ef73-4b9c-8b45-a9a411fc5c10,rmygzuqd,Male,1982-10-23,Orthopedics,ulqxp@domain.com,lehpyfkoqmnzvbuarixj,numero: 4; street: dblmpojqnk; city: hbwqui; postal_code: 46623,+9569594312; +8937441365,edbngs; gipcb
df2bdf47-c434-4f23-93c1-a044c0d71138,ergfblid,Female,1982-06-26,Pediatrics,odvrg@domain.com,srzgyhpqvtoudmjbxknc,numero: 76; street: flbthyiqva; city: newhkr; postal_code: 55618,+7139052859; +7164177329,gilmvc; dpbul
6b4d5751-9fce-417f-9417-5cdc9e6a22b3,cqtwermp,Male,1991-04-04,Cardiology,ojxaz@domain.com,wlzenvoakrsihgdjytxc,numero: 83; street: keisrfjbwc; city: yfqjkd; postal_code: 31715,+4883678114; +4591164622,njhstx; rylxf
c6d18db5-475a-4140-b055-19f4a198486d,msrbfpug,Male,1992-03-05,Cardiology,cebag@domain.com,bphujvfdweostxzqkcrl,numero: 38; street: pjdyxncogm; city: wvqnil; postal_code: 70408,+1794263050; +9288311553,sehmtv; agicp
449f1774-96be-4024-b7f2-6d8bfaa4248d,aksbmhxf,Female,1975-03-15,Cardiology,mkptr@domain.com,wyxvqnosfmtuclgzdpai,numero: 79; street: erhaduimgk; city: fsdbmn; postal_code: 81329,+3194647759; +7778498220,kdanec; yzqoa
a2bfdeba-3ae7-4685-a86e-896b3d70a44b,ziqujaok,Female,1987-05-09,Orthopedics,bonpy@domain.com,vflzqoxmapbwucirkjeh,numero: 73; street: xjvzmoksen; city: zkciwp; postal_code: 58354,+1322904455; +4504578586,tmdkgs; swbud
9b61d6d0-ba7b-4b2a-af8d-350d18a9a3fd,zbwgtdai,Female,1993-02-07,Orthopedics,hzwob@domain.com,dxlyiohwcjgqpszkumvn,numero: 9; street: xmiqftolde; city: smgpoy; postal_code: 16113,+6401775752; +3387016034,qnzyjg; qdovl
e9f25ba5-3c05-43cd-aa0c-4c3710f40767,zrgtpkce,Female,1964-05-27,Pediatrics,ktyrl@domain.com,yxzatifkugdcmprwlsov,numero: 23; street: vuzmkyqlid; city: qrmelz; postal_code: 61920,+8767175747; +2636687673,ijnkmh; jwvqi
650a378c-122e-4cf3-8351-6fafc77d369e,pcgxndus,Male,1977-07-16,Cardiology,dszix@domain.com,ngefvbltqzcaijuksmhw,numero: 28; street: uipfaocvzn; city: rjmpcs; postal_code: 64723,+3261370252; +9468305434,bedmlq; sbjlg
b2982bfd-012c-4e5c-8044-e900228c7793,cwpilaxt,Female,1971-03-13,Cardiology,plmny@domain.com,lswvkebnrmdjupctxfhq,numero: 1; street: esocvwbtur; city: gbuwkr; postal_code: 42464,+7022285376; +2195406466,qzkver; docki
519e9135-e853-4f57-81a8-fb1d14153617,aoytfjeb,Male,1995-11-11,Cardiology,bktrn@domain.com,ksjgfrdcmyvxbpaouniq,numero: 16; street: cwbxunfath; city: fqympg; postal_code: 62248,+1603511938; +1145410216,pdjlfe; ilogc
8b2115fd-0e72-4b5f-bb97-f72af105c6a4,invemryb,Female,1976-12-09,Orthopedics,fytpb@domain.com,tqvpfoxnrejlwhzikdas,numero: 49; street: apomqwlzsi; city: fieyad; postal_code: 35862,+8645193537; +6680879478,qoxpnv; jtwhq
c2661878-31a1-4131-89a3-af58fd9aef77,fhicetxb,Male,1986-06-10,Orthopedics,gdcsn@domain.com,cvtnwgrmajdselbqfuik,numero: 51; street: fselvbrtoz; city: fpbtwo; postal_code: 68794,+2957020524; +2098213012,nfwbhl; gwatc
ae209e45-3d00-4d83-a6f1-32c19ae81261,lpnukcxf,Female,1989-07-20,Orthopedics,qlojk@domain.com,qsutvgxyjncewkrhoflm,numero: 87; street: yisctfdagu; city: thnjxe; postal_code: 66075,+8364061894; +4793870738,vrwxqy; eiwqc
b2e0019b-df89-41b5-adcc-ec050eb77329,wotsdjga,Male,1970-11-25,Neurology,slakg@domain.com,oknuaerphlticbvwjgyz,numero: 2; street: qnswahzdil; city: yiftmu; postal_code: 38430,+1567988937; +5039460730,wnemuh; txakm
59ca8ac6-754f-49eb-b7cb-562123e7d699,soaudzxv,Male,1987-08-20,Neurology,ewlqi@domain.com,urckhdfijbqasgymtnwx,numero: 21; street: fcvrbumlzp; city: bipoqx; postal_code: 85298,+8867930133; +5649582775,whubsd; aqdch
29aabe1d-44ad-4f6d-9b19-cbe2f245bc5c,vlkqbhuw,Male,1966-08-09,Dermatology,spuhz@domain.com,syuarjnqklhedzvtcwob,numero: 15; street: uqrydhcspg; city: nuqgph; postal_code: 75929,+4075510902; +7393279937,xfmbsr; ugykm
c0d2fb1f-7a47-4ed4-9e1c-9d451a3cf379,vndxsqmp,Male,1972-09-28,Cardiology,msvlw@domain.com,ocyfnjdbiarepwqkxhvs,numero: 100; street: hpskagztfw; city: ytgorf; postal_code: 61973,+8143420059; +7360112659,baiehn; luhkc
